File Name,URL,player_id,DateTimeOriginal,Date,TimeOfDay,NoOfFaces,Focus,Shot Type,event_id,mood_id,action_id,caption,apparel,brands_and_logos,sublocation_id,Location,Make,Model,Copyright,Photographer
JSA02515.jpg,https://drive.google.com/file/d/11WGulTfFaB_Gl2z3i54SPi9IU0RCpol1/view?usp=drivesdk,p8,2025/01/10 12:28,2025/01/10,Afternoon,1,"Solo,Alone",Wide shot,e1,m1,a4,A cricketer in Joburg Super Kings gear powerfully drives a ball during a SA20 match practice.,Practice Jersey,"{Betway, Mahindra, Peach Payments,Joburg Super Kings,FedEx,Betway,SA20}",s1,,SONY,ILCE-7M4,CHENNAI SUPER KINGS,Siddharth K
JSA02507.jpg,https://drive.google.com/file/d/1S35VIjswKYwJpa-5Vh0LMOC7TmkD5BYz/view?usp=drivesdk,p8,2025/01/10 12:23,2025/01/10,Afternoon,1,"Solo,Alone",Wide shot,e1,m1,a4,"A cricketer powerfully swings his bat, his focused expression evident.",Practice Jersey,"{Betway, Mahindra, Peach Payments,Joburg Super Kings,FedEx,Betway,SA20}",s1,,SONY,ILCE-7M4,CHENNAI SUPER KINGS,Siddharth K
JSA02497.jpg,https://drive.google.com/file/d/1U2jxGWYsPWKNygRLLsIZzQd0jrrSveB7/view?usp=drivesdk,"p4,p16",2025/01/10 12:22,2025/01/10,Afternoon,2,"Group,together",Wide shot,e1,m1,a4,Green-jersey players practice batting on sunny field; one focused on swing.,Practice Jersey,"{Betway, Mahindra, Peach Payments,Joburg Super Kings,FedEx,Betway,SA20}",s1,,SONY,ILCE-7M4,CHENNAI SUPER KINGS,Siddharth K
JSA02494.jpg,https://drive.google.com/file/d/1wH8OWp1_NlpvAuvJkYIOIShxKhW3nz3Q/view?usp=drivesdk,p4,2025/01/10 12:21,2025/01/10,Afternoon,1,"Solo,Alone",Wide shot,e1,m1,a4,Cricket players practice batting during a sunny day at a nets session.,Practice Jersey,"{Betway, Mahindra, Peach Payments,Joburg Super Kings,FedEx,Betway,SA20}",s1,,SONY,ILCE-7M4,CHENNAI SUPER KINGS,Siddharth K
JSA02489.jpg,https://drive.google.com/file/d/1B4ZcST2pLK-ReUI0kE5d2KRiqtf4toBm/view?usp=drivesdk,p16,2025/01/10 12:20,2025/01/10,Afternoon,1,"Solo,Alone",Wide shot,e1,m1,a4,"Two cricket players in bright green jerseys Practice Batting at the netsone focused, the other adjusting gear, with Betway logo in background.",Practice jersey,"{Betway, Mahindra, Peach Payments,Joburg Super Kings,FedEx,Betway,SA20}",s1,,SONY,ILCE-7M4,CHENNAI SUPER KINGS,Siddharth K
JSA02487.jpg,https://drive.google.com/file/d/1VKfrwtyaJ1EOgfOUFE9b3aINcJ7-bnAK/view?usp=drivesdk,"p4,p16",2025/01/10 12:20,2025/01/10,Afternoon,2,"Group,together",Wide shot,e1,m1,a4,"CSK players practice batting; one focused, the other observing.",Practice Jersey,"{Betway, Mahindra, Peach Payments,Joburg Super Kings,FedEx,Betway,SA20}",s1,,SONY,ILCE-7M4,CHENNAI SUPER KINGS,Siddharth K
JSA02479.jpg,https://drive.google.com/file/d/1N4XGRUprAsDe8C0VLHnGjuiSsmPYrgUX/view?usp=drivesdk,p17,2025/01/10 12:07,2025/01/10,Afternoon,1,"Solo,Alone",Close shot,e1,m2,a8,Smiling Johannesburg Super Kings cricketer gives a thumbs up at the Stadium.,Practice Jersey,"{Betway, Mahindra, Peach Payments,Joburg Super Kings,FedEx,Betway,SA20}",s2,,SONY,ILCE-7M4,CHENNAI SUPER KINGS,Siddharth K
JSA02481.jpg,https://drive.google.com/file/d/1q5jPRiuGhsQiHfBqs4XXxeiji5_m_f_Q/view?usp=drivesdk,p17,2025/01/10 12:08,2025/01/10,Afternoon,1,"Solo,Alone",Close shot,e1,m3,a8,"A young cricket player in green stands with arms crossed, serious during a SA20 match.",Casual attire,none,s2,,SONY,ILCE-7M4,CHENNAI SUPER KINGS,Siddharth K
JSA02477.jpg,https://drive.google.com/file/d/1N62P8Q4bgq5uQSnVZ5XNr7-MpS22dKME/view?usp=drivesdk,p17,2025/01/10 12:07,2025/01/10,Afternoon,1,"Solo,Alone",Wide shot,e1,m1,a8,"A cricket player in green stands with arms crossed, looking into the camera with a Stadium behind.",Practice Jersey,"{Betway, Mahindra, Peach Payments,Joburg Super Kings,FedEx,Betway,SA20}",s2,,SONY,ILCE-7M4,CHENNAI SUPER KINGS,Siddharth K
JSA02475.jpg,https://drive.google.com/file/d/1FlVf8vERMoWszvilHovIEU60fbw-QuYB/view?usp=drivesdk,p17,2025/01/10 12:07,2025/01/10,Afternoon,1,"Solo,Alone",Close shot,e1,m1,a8,"A young male cricketer stands arms crossed in bright green, serious and direct.",Casual attire,none,s2,,SONY,ILCE-7M4,CHENNAI SUPER KINGS,Siddharth K
JSA02473.jpg,https://drive.google.com/file/d/1jchlSGhrXpnQTv1kcNTqymowUhOWUmB5/view?usp=drivesdk,p17,2025/01/10 12:07,2025/01/10,Afternoon,1,"Solo,Alone",Wide shot,e1,m3,a8,"A young cricketer stands confidently with arms crossed on the field, vibrant jersey and Stadium backdrop.",Practice Jersey,"{Betway, Mahindra, Peach Payments,Joburg Super Kings,FedEx,Betway,SA20}",s2,,SONY,ILCE-7M4,CHENNAI SUPER KINGS,Siddharth K
JSA02472.jpg,https://drive.google.com/file/d/1uwR_Jt_hh2vP1cdijFDWfs4cLBLvwAiO/view?usp=drivesdk,p17,2025/01/10 12:07,2025/01/10,Afternoon,1,"Solo,Alone",Close shot,e1,m3,a8,"A young male cricketer in green stands hands on hips, serious, with blurred Stadium behind.",Practice Jersey,"{Betway, Mahindra, Peach Payments,Joburg Super Kings,FedEx,Betway,SA20}",s2,,SONY,ILCE-7M4,CHENNAI SUPER KINGS,Siddharth K
JSA02468.jpg,https://drive.google.com/file/d/15nfVr9-Cd5n8hifHQAHrmfrtn_V8rx2L/view?usp=drivesdk,p17,2025/01/10 12:06,2025/01/10,Afternoon,1,"Solo,Alone",Wide shot,e1,m1,a17,"A cricketer in green jogs across the field during Practice at a near-empty Stadium, focused on preparation.",Practice Jersey,"{Betway, Mahindra, Peach Payments,Joburg Super Kings,FedEx,Betway,SA20}",s2,,SONY,ILCE-7M4,CHENNAI SUPER KINGS,Siddharth K
JSA02466.jpg,https://drive.google.com/file/d/13_qNC4uT9AL5RYuaPq16paV2HwiGkPSn/view?usp=drivesdk,"p17,p23",2025/01/10 12:06,2025/01/10,Afternoon,2,"Group,together",Wide shot,e1,m1,a5,"Two green-uniformed players, one coach, walk field during stadium practice. Focused.",Practice jersey,"{Betway, Mahindra, Peach Payments,Joburg Super Kings,FedEx,Betway,SA20}",s2,,SONY,ILCE-7M4,CHENNAI SUPER KINGS,Siddharth K
JSA02461.jpg,https://drive.google.com/file/d/19AteIbOm4OtnnS2JzpI_hbrCb36p_TnP/view?usp=drivesdk,p17,2025/01/10 11:55,2025/01/10,Morning,1,"Solo,Alone",Wide shot,e1,m1,a5,"A cricketer in green Mahindra Super Kings jersey walks to the pitch, serious, during an SA20 match.",Practice Jersey,"{Betway, Mahindra, Peach Payments,Joburg Super Kings,FedEx,Betway,SA20}",s1,,SONY,ILCE-7M4,CHENNAI SUPER KINGS,Siddharth K
JSA02457.jpg,https://drive.google.com/file/d/1K0ynwRkDIe85Yu03ngcw6VdaaR2ipHoS/view?usp=drivesdk,p5,2025/01/10 11:51,2025/01/10,Morning,1,"Solo,Alone",Wide shot,e1,m1,a19,"A cricket player performs a dynamic stretch on the field, smiling confidently before a match at the stadium.",Practice Jersey,"{Betway, Mahindra, Peach Payments,Joburg Super Kings,FedEx,Betway,SA20}",s2,,SONY,ILCE-7M4,CHENNAI SUPER KINGS,Siddharth K
JSA02453.jpg,https://drive.google.com/file/d/1H57okUXM9RVFl90qZ0nPdumRiDzf4yj0/view?usp=drivesdk,p23,2025/01/10 11:51,2025/01/10,Morning,1,"Solo,Alone",Wide shot,e1,m1,a13,"Three Johannesburg Super Kings cricket team memberstwo coaches and a playerconverse on the pitch during a Practice session at the Wanderers Stadium in Johannesburg, South Africa.",Practice Jersey,"{Betway, Mahindra, Peach Payments,Joburg Super Kings,FedEx,Betway,SA20}",s2,,SONY,ILCE-7M4,CHENNAI SUPER KINGS,Siddharth K
JSA02460.jpg,https://drive.google.com/file/d/1nPNdrgzBiTmuxMpQz9wnnikqBF3Nc3JW/view?usp=drivesdk,p17,2025/01/10 11:54,2025/01/10,Morning,1,"Solo,Alone",Wide shot,e1,m1,a5,"A player in green SA20 League jersey walks through the player tunnel, serious, with Betway branding visible.",Practice Jersey,"{Betway, Mahindra, Peach Payments,Joburg Super Kings,FedEx,Betway,SA20}",s2,,SONY,ILCE-7M4,CHENNAI SUPER KINGS,Siddharth K
JSA02450.jpg,https://drive.google.com/file/d/13KSrCJz8KFnfQAz4Y_5sdlwl8i8mYd_n/view?usp=drivesdk,p2,2025/01/10 11:49,2025/01/10,Morning,1,"Solo,Alone",Wide shot,e1,m1,a19,"A cricket player in a green jersey stretches on the field, sitting cross-legged, focused on his warm-up.",Practice Jersey,"{Betway, Mahindra, Peach Payments,Joburg Super Kings,FedEx,Betway,SA20}",s2,,SONY,ILCE-7M4,CHENNAI SUPER KINGS,Siddharth K
JSA02449.jpg,https://drive.google.com/file/d/1eF75AGbT53k-mlWnigjR7ncQ5gsj8Ivw/view?usp=drivesdk,p5,2025/01/10 11:48,2025/01/10,Morning,1,"Solo,Alone",Close shot,e1,m1,a19,A cricket player in green stretches his hamstring on the grass.,Practice Jersey,"{Betway, Mahindra, Peach Payments,Joburg Super Kings,FedEx,Betway,SA20}",s3,,SONY,ILCE-7M4,CHENNAI SUPER KINGS,Siddharth K
JSA02446.jpg,https://drive.google.com/file/d/15SAQwynRaHkb-eQPjp8u-KbReEDg6Luy/view?usp=drivesdk,"p27,p8",2025/01/10 11:44,2025/01/10,Morning,2,"Group,together",Wide shot,e1,m1,a13,Two coaches in green discuss strategy on stadium field during practice.,Practice Jersey,"{Betway, Mahindra, Peach Payments,Joburg Super Kings,FedEx,Betway,SA20}",s2,,SONY,ILCE-7M4,CHENNAI SUPER KINGS,Siddharth K
JSA02444.jpg,https://drive.google.com/file/d/1C4n3bdz1i6XUK7W08XUSRApMlUO5n4Bw/view?usp=drivesdk,p6,2025/01/10 11:42,2025/01/10,Morning,1,"Solo,Alone",Wide shot,e1,m1,a11,"Cricket players in green chat on sunny field; one holds soccer ball, stadium scoreboard behind.",Practice Jersey,"{Betway, Mahindra, Peach Payments,Joburg Super Kings,FedEx,Betway,SA20}",s2,,SONY,ILCE-7M4,CHENNAI SUPER KINGS,Siddharth K
JSA02441.jpg,https://drive.google.com/file/d/1l6pL5LRaUj-t6na9_gNPqcotGondrz5C/view?usp=drivesdk,p8,2025/01/10 11:42,2025/01/10,Morning,1,"Solo,Alone",Wide shot,e1,m1,a19,"A cricket player stretches his leg, smiling, during a sunny practice session at the stadium.",Practice Jersey,"{Betway, Mahindra, Peach Payments,Joburg Super Kings,FedEx,Betway,SA20}",s2,,SONY,ILCE-7M4,CHENNAI SUPER KINGS,Siddharth K
JSA02433.jpg,https://drive.google.com/file/d/1zA0BQrKd_tZowxl8kH-YlXN9eajABSxd/view?usp=drivesdk,p8,2025/01/10 11:42,2025/01/10,Morning,1,"Solo,Alone",Wide shot,e1,m1,a17,A Johannesburg Super Kings player jogs across the field during a training session at the stadium.,Practice Jersey,"{Betway, Mahindra, Peach Payments,Joburg Super Kings,FedEx,Betway,SA20}",s2,,SONY,ILCE-7M4,CHENNAI SUPER KINGS,Siddharth K
JSA02428.jpg,https://drive.google.com/file/d/1iCnXDXWTnYnyHw6xrJz8CixdBv59Oual/view?usp=drivesdk,p27,2025/01/10 11:41,2025/01/10,Morning,1,"Solo,Alone",Close shot,e1,m1,a19,"A South African cricketer stretches with a resistance band on Newlands pitch, focused.",Practice Jersey,"{Betway, Mahindra, Peach Payments,Joburg Super Kings,FedEx,Betway,SA20}",s2,,SONY,ILCE-7M4,CHENNAI SUPER KINGS,Siddharth K
JSA02426.jpg,https://drive.google.com/file/d/1jYx-pQlSITt1CeSRaUQBkeLFFtGFTYBP/view?usp=drivesdk,p8,2025/01/10 11:36,2025/01/10,Morning,1,"Solo,Alone",Wide shot,e1,m1,a5,"A Johannesburg Super Kings cricketer walks off the field, head down, during a SA20 match practice at the Wanderers Stadium in Johannesburg.",Practice Jersey,"{Betway, Mahindra, Peach Payments,Joburg Super Kings,FedEx,Betway,SA20}",s2,,SONY,ILCE-7M4,CHENNAI SUPER KINGS,Siddharth K
JSA02421.jpg,https://drive.google.com/file/d/188BiSnxbA-ttgiCF3BSOJuBOZw8VhQoe/view?usp=drivesdk,p23,2025/01/10 11:33,2025/01/10,Morning,1,"Solo,Alone",Wide shot,e1,m1,a5,"A Johannesburg Super Kings coach strides across the Wanderers Stadium pitch during a SA20 League match, seemingly pensive.",Practice Jersey,"{Betway, Mahindra, Peach Payments,Joburg Super Kings,FedEx,Betway,SA20}",s2,,SONY,ILCE-7M4,CHENNAI SUPER KINGS,Siddharth K
JSA02417.jpg,https://drive.google.com/file/d/1p8Y00SBujk7wE9oihVoCAMQOnUFQExS6/view?usp=drivesdk,"p22,p4",2025/01/10 11:30,2025/01/10,Morning,2,"Group,together",Wide shot,e1,m1,a5,"Two players in green-yellow kits, one in flip-flops, chat near team bus in South Africa.",Practice Jersey,"{Betway, Mahindra, Peach Payments,Joburg Super Kings,FedEx,Betway,SA20}",s2,,SONY,ILCE-7M4,CHENNAI SUPER KINGS,Siddharth K
JSA02419.jpg,https://drive.google.com/file/d/18cYP_BLARsOweFBMQl-XeLtGh3jP4fgb/view?usp=drivesdk,p23,2025/01/10 11:33,2025/01/10,Morning,1,"Solo,Alone",Wide shot,e1,m1,a5,"A Johannesburg Super Kings coach strolls across the lush green cricket pitch at the Wanderers Stadium, seemingly pensive. The SA20 League banners are visible in the background.",Practice Jersey,"{Betway, Mahindra, Peach Payments,Joburg Super Kings,FedEx,Betway,SA20}",s2,,SONY,ILCE-7M4,CHENNAI SUPER KINGS,Siddharth K
JSA02413.jpg,https://drive.google.com/file/d/1LMCtD29pa6YOK-1lpQdKILaiDKFxIKnz/view?usp=drivesdk,"p9,p21",2025/01/10 11:30,2025/01/10,Morning,2,"Group,together",Wide shot,e1,m1,a22,"Cricket players in green jerseys disembark a team bus, carrying equipment, after a match in South Africa.  One player carries a bat.",Practice Jersey,"{Betway, Mahindra, Peach Payments,Joburg Super Kings,FedEx,Betway,SA20}",s4,,SONY,ILCE-7M4,CHENNAI SUPER KINGS,Siddharth K
JSA02412.jpg,https://drive.google.com/file/d/1efyfo1RnXnOLnGUNa1Aloe5oEtvdCf5b/view?usp=drivesdk,"p17,p9",2025/01/10 11:30,2025/01/10,Morning,2,"Group,together",Wide shot,e1,m1,a5,"Green-jersey players with bags exit bus, serious and game-ready.",Practice jersey,"{Betway, Mahindra, Peach Payments,Joburg Super Kings,FedEx,Betway,SA20}",s2,,SONY,ILCE-7M4,CHENNAI SUPER KINGS,Siddharth K
JSA02403.jpg,https://drive.google.com/file/d/1ugHJrOmQ4g1fkKSZvzFzJr60jH9Uno0E/view?usp=drivesdk,"p5,p6",2025/01/10 11:30,2025/01/10,Morning,2,"Group,together",Wide shot,e6,m1,a5,"Cricket players disembark a team bus, smiles on their faces, ready for a match.",Practice jersey,"{Betway, Mahindra, Peach Payments,Joburg Super Kings,FedEx,Betway,SA20}",s9,,SONY,ILCE-7M4,CHENNAI SUPER KINGS,Siddharth K
JSA02409.jpg,https://drive.google.com/file/d/1p67ageMtw_YNtB8zpXKPfeNNheRCe0c0/view?usp=drivesdk,"p25,p16",2025/01/10 11:30,2025/01/10,Morning,2,"Group,together",Wide shot,e1,m1,a5,"Smiling JSK players step off team bus in green kits, ready for match.",Practice Jersey,"{Betway, Mahindra, Peach Payments,Joburg Super Kings,FedEx,Betway,SA20}",s4,,SONY,ILCE-7M4,CHENNAI SUPER KINGS,Siddharth K
JSA02407.jpg,https://drive.google.com/file/d/1LiT5htk7uaMH-2VajXBlev_Rv9H3l9y7/view?usp=drivesdk,"p25,p22,p16",2025/01/10 11:30,2025/01/10,Morning,3,"Group,together",Wide shot,e1,m1,a5,"Green and yellow uniformed players exit bus, smiling; one stands out.",Practice Jersey,"{Betway, Mahindra, Peach Payments,Joburg Super Kings,FedEx,Betway,SA20}",s2,,SONY,ILCE-7M4,CHENNAI SUPER KINGS,Siddharth K
JSA02394.jpg,https://drive.google.com/file/d/1Klb3e15sS2FzJU9jLJw0uCsmOFxK9VPy/view?usp=drivesdk,p27,2025/01/10 11:30,2025/01/10,Morning,1,"Solo,Alone",Wide shot,e6,m1,a5,A cheerful cricketer in yellow-green Super Kings jersey walks to the team bus post-match in Johannesburg.,Practice Jersey,"{Betway, Mahindra, Peach Payments,Joburg Super Kings,FedEx,Betway,SA20}",s2,,SONY,ILCE-7M4,CHENNAI SUPER KINGS,Siddharth K
JSA02389.jpg,https://drive.google.com/file/d/19r3TAo7d4gytkxtQk_SHM043z6uwzPwC/view?usp=drivesdk,"p8,p2",2025/01/10 11:30,2025/01/10,Morning,2,"Group,together",Wide shot,e6,m1,a5,Cricket players in green disembark a team bus before a match in South Africa.,Practice Jersey,"{Betway, Mahindra, Peach Payments,Joburg Super Kings,FedEx,Betway,SA20}",s9,,SONY,ILCE-7M4,CHENNAI SUPER KINGS,Siddharth K
JSA02392.jpg,https://drive.google.com/file/d/1GMxPP-z9KMsprFf3qxP4fS41t4iGBHC3/view?usp=drivesdk,p2,2025/01/10 11:30,2025/01/10,Morning,1,"Solo,Alone",Wide shot,e6,m1,a5,"A Johannesburg Super Kings player, looking pensive, disembarks a team bus.",Practice Jersey,"{Betway, Mahindra, Peach Payments,Joburg Super Kings,FedEx,Betway,SA20}",s4,,SONY,ILCE-7M4,CHENNAI SUPER KINGS,Siddharth K
JSA04635.jpg,https://drive.google.com/file/d/1cpD1Tbgn6ES0JveEkZj1h1Pe6o_48Ndw/view?usp=drivesdk,p3,2025/01/13 14:35,2025/01/13,Afternoon,1,"Solo,Alone",Close shot,e3,m1,a23,"A player orders take-off at a self-service kiosk at McDonald's, choosing ""take away"".",practice jersey,"{Betway, Mahindra, Peach Payments,Joburg Super Kings,FedEx,Betway,SA20}",s7,,SONY,ILCE-7M4,CHENNAI SUPER KINGS,Siddharth K
JSA04647.jpg,https://drive.google.com/file/d/1N-JIr1vfvwGkcbb6WXMATxUg3cynOnz9/view?usp=drivesdk,p3,2025/01/13 14:37,2025/01/13,Afternoon,1,"Solo,Alone",Wide shot,e4,m1,a24,JSK player smiles while paying at McDonald's with Peach device; staff assists.,Practice jersey,"{Betway, Mahindra, Peach Payments,Joburg Super Kings,FedEx,Betway,SA20}",s7,,SONY,ILCE-7M4,CHENNAI SUPER KINGS,Siddharth K
JSA04630.jpg,https://drive.google.com/file/d/1wd5HMfbyJoYQuf9kdaDcoMkjMR1iUr41/view?usp=drivesdk,p5,2025/01/13 14:32,2025/01/13,Afternoon,1,"Solo,Alone",Wide shot,e3,m1,a23,"A cricket player orders at a McDonald's self-service kiosk, his expression focused on the screen.",Practice Jersey,"{Betway, Mahindra, Peach Payments,Joburg Super Kings,FedEx,Betway,SA20}",s7,,SONY,ILCE-7M4,CHENNAI SUPER KINGS,Siddharth K
JSA04651.jpg,https://drive.google.com/file/d/1q-2U3qD67kA0qqRVK1O-6WqO-qzi-TK2/view?usp=drivesdk,"p3,p12,p24,p4",2025/01/13 14:39,2025/01/13,Afternoon,4,"Group,together",Wide shot,e4,m2,a8,Super Kings team poses with McDonalds staff at promo event in South Africa.,Practice Jersey,"{Betway, Mahindra, Peach Payments,Joburg Super Kings,FedEx,Betway,SA20}",s5,,SONY,ILCE-7M4,CHENNAI SUPER KINGS,Siddharth K
JSA04642.jpg,https://drive.google.com/file/d/1KPYJ4436yeCfG_xhx04zC0ZTBs6dP10x/view?usp=drivesdk,p3,2025/01/13 14:36,2025/01/13,Afternoon,1,"Solo,Alone",Wide shot,e3,m1,a23,"Cricket player pays at a McDonald's counter, smiling at the cashier.",practice jersey,"{Betway, Mahindra, Peach Payments,Joburg Super Kings,FedEx,Betway,SA20}",s7,,SONY,ILCE-7M4,CHENNAI SUPER KINGS,Siddharth K
JSA04633.jpg,https://drive.google.com/file/d/1K0jG7ZrVAr8o5dLVnmB6gOxg6tVUwBFG/view?usp=drivesdk,"p12,p4,p24",2025/01/13 14:34,2025/01/13,Afternoon,3,"Group,together",Wide shot,e1,m1,a13,"Four players in green jerseys at table, talking strategy. Serious faces.",Practice jersey,"{Betway, Mahindra, Peach Payments,Joburg Super Kings,FedEx,Betway,SA20}",s8,,SONY,ILCE-7M4,CHENNAI SUPER KINGS,Siddharth K
JSA04613.jpg,https://drive.google.com/file/d/1tSnEsT6zQuvnN3ynL-4yrqdW2e20OY4b/view?usp=drivesdk,p3,2025/01/13 14:29,2025/01/13,Afternoon,1,"Solo,Alone",Wide shot,e3,m1,a30,JSK player delivers an order at a McDonald's drive-thru window. ,practice jersey,"{Betway, Mahindra, Peach Payments,Joburg Super Kings,FedEx,Betway,SA20}",s7,,SONY,ILCE-7M4,CHENNAI SUPER KINGS,Siddharth K
JSA04626.jpg,https://drive.google.com/file/d/1fre582_0k1FTzLqhlOVZruvjt1WtX7DG/view?usp=drivesdk,p4,2025/01/13 14:31,2025/01/13,Afternoon,1,"Solo,Alone",Wide shot,e3,m1,a26,A player hands a customer their order drive-thru at McDonald's on a rainy day.,Casual attire,none,s7,,SONY,ILCE-7M4,CHENNAI SUPER KINGS,Siddharth K
JSA04629.jpg,https://drive.google.com/file/d/1yEOVpuGjbKw6gqJ0ezIpWmYyFeZssh9X/view?usp=drivesdk,"p4,p12,p24",2025/01/13 14:32,2025/01/13,Afternoon,3,"Group,together",Wide shot,e4,m1,a30,Man in green jacket picks up McDonald's order at drive-thru. Colleagues nearby.,Casual attire,none,s4,,SONY,ILCE-7M4,CHENNAI SUPER KINGS,Siddharth K
JSA04611.jpg,https://drive.google.com/file/d/1tHQT4N2SUE6Ix3Q42CvX_bhaN7ocZhoC/view?usp=drivesdk,p12,2025/01/13 14:27,2025/01/13,Afternoon,1,"Solo,Alone",Close shot,e1,m1,a30,"A fast-food drive-thru worker hands drinks to a customer on a rainy day, looking slightly weary.",Casual attire,none,s4,,SONY,ILCE-7M4,CHENNAI SUPER KINGS,Siddharth K
JSA04600.jpg,https://drive.google.com/file/d/1_mqUeWFMPtxhSKyRWDkGQiNQvTLXFN9r/view?usp=drivesdk,p12,2025/01/13 14:26,2025/01/13,Afternoon,1,"Solo,Alone",Wide shot,e4,m1,a30,"A fast-food drive-thru worker, in a green shirt, hands a smiling customer their order.",Casual attire,none,s4,,SONY,ILCE-7M4,CHENNAI SUPER KINGS,Siddharth K
JSA04608.jpg,https://drive.google.com/file/d/1lc0F0EF-FgvLRaXtnmdpmNRYZq-Y4gQv/view?usp=drivesdk,p12,2025/01/13 14:27,2025/01/13,Afternoon,1,"Solo,Alone",Wide shot,e4,m1,a30,A drive-thru worker gives a McDonald's coffee to a customer on a rainy daythe customer's hand visible.,Casual attire,none,s4,,SONY,ILCE-7M4,CHENNAI SUPER KINGS,Siddharth K
JSA04599.jpg,https://drive.google.com/file/d/18dDzuicEx7kqwvU-CyR0xmno-vgesSJS/view?usp=drivesdk,"p12,p22",2025/01/13 14:26,2025/01/13,Afternoon,2,"Group,together",Wide shot,e4,m1,a30,McDonald's drive-thru order handed to customer filming it. Driver and passenger pleased.,Casual attire,none,s4,,SONY,ILCE-7M4,CHENNAI SUPER KINGS,Siddharth K
JSA04617.jpg,https://drive.google.com/file/d/1WKdN_RMa3wGAqGieBP-uQ0GrapCm6V_L/view?usp=drivesdk,p3,2025/01/13 14:29,2025/01/13,Afternoon,1,"Solo,Alone",Wide shot,e3,m1,a30,JSK player hands a customer their order through the drive-thru window on a rainy day.,practice jersey,"{Betway, Mahindra, Peach Payments,Joburg Super Kings,FedEx,Betway,SA20}",s7,,SONY,ILCE-7M4,CHENNAI SUPER KINGS,Siddharth K
JSA04583.jpg,https://drive.google.com/file/d/1ltcIq_3dzHoBwHdsDtHknEScZR4vbE1m/view?usp=drivesdk,p4,2025/01/13 14:23,2025/01/13,Afternoon,1,"Solo,Alone",Wide shot,e3,m1,a26,A player hands a customer their order drive-thru at McDonald's as the customer waits patiently in their car.,Casual attire,none,s7,,SONY,ILCE-7M4,CHENNAI SUPER KINGS,Siddharth K
JSA04586.jpg,https://drive.google.com/file/d/1pAdUAn4wM7dMWVu995IdExO0TE6jurUU/view?usp=drivesdk,p4,2025/01/13 14:23,2025/01/13,Afternoon,1,"Solo,Alone",Wide shot,e3,m1,a8,"A Joburg Super Kings player gives a thumbs-up, smiling at a McDonald's drive-thru.",Practice jersey,"{Betway, Mahindra, Peach Payments,Joburg Super Kings,FedEx,Betway,SA20}",s7,,SONY,ILCE-7M4,CHENNAI SUPER KINGS,Siddharth K
JSA04576.jpg,https://drive.google.com/file/d/19fBm0VMyTD4kkZrUkAhH2bDPN_qW8Id_/view?usp=drivesdk,"p12,p24",2025/01/13 14:21,2025/01/13,Afternoon,2,"Group,together",Wide shot,e4,m2,a8,CSK players pose in kitchen with South African fan holding flag. Thumbs up.,Practice jersey,"{Betway, Mahindra, Peach Payments,Joburg Super Kings,FedEx,Betway,SA20}",s4,,SONY,ILCE-7M4,CHENNAI SUPER KINGS,Siddharth K
JSA04578.jpg,https://drive.google.com/file/d/1ajDLlwPquBz3sS1FBl1YBiYVm6p1oj10/view?usp=drivesdk,p12,2025/01/13 14:21,2025/01/13,Afternoon,1,"Solo,Alone",Wide shot,e4,m2,a8,"Two men, one in a Johannesburg Super Kings jacket and the other draped in a South African flag, smile and give thumbs up in a kitchen.",practice jersey,"{Betway, Mahindra, Peach Payments,Joburg Super Kings,FedEx,Betway,SA20}",s4,,SONY,ILCE-7M4,CHENNAI SUPER KINGS,Siddharth K
JSA04571.jpg,https://drive.google.com/file/d/177rBASGxjMBLni0tjFgMP7wkkuC2LA7H/view?usp=drivesdk,"p12,p24,p4,p3",2025/01/13 14:19,2025/01/13,Afternoon,4,"Group,together",Wide shot,e4,m2,a12,"Smiling Lions players visit McDonalds, laugh with staff at promo event.",practice jersey,"{Betway, Mahindra, Peach Payments,Joburg Super Kings,FedEx,Betway,SA20}",s4,,SONY,ILCE-7M4,CHENNAI SUPER KINGS,Siddharth K
JSA04569.jpg,https://drive.google.com/file/d/15P_77aHvYlTGFE0n_l39MzdpMavBarXw/view?usp=drivesdk,p12,2025/01/13 14:19,2025/01/13,Afternoon,1,"Solo,Alone",Close shot,e4,m1,a11,A Chennai Super Kings player in a green jacket smiles while watching a busy McDonald's kitchen.,practice jersey,"{Betway, Mahindra, Peach Payments,Joburg Super Kings,FedEx,Betway,SA20}",s4,,SONY,ILCE-7M4,CHENNAI SUPER KINGS,Siddharth K
JSA04574.jpg,https://drive.google.com/file/d/1XbSe8xhX1LGQbzqGHJoLtgQK96rWWCBd/view?usp=drivesdk,"p24,p3,p4",2025/01/13 14:20,2025/01/13,Afternoon,3,"Group,together",Wide shot,e3,m2,a10,Green-uniformed players applaud McDonald's staff in yellow during kitchen visit.,practice jersey,"{Betway, Mahindra, Peach Payments,Joburg Super Kings,FedEx,Betway,SA20}",s4,,SONY,ILCE-7M4,CHENNAI SUPER KINGS,Siddharth K
JSA05099.jpg,https://drive.google.com/file/d/1xzcvXGSl8sxJpUWmSpVwKLkISTVbpK87/view?usp=drivesdk,"p25,p8,p23",2025/01/13 16:57,2025/01/13,Evening,3,"Group,together",Wide shot,e1,m1,a11,Coaches and players in green huddle indoors during practice; ball floats mid-air.,Practice jersey,"{Betway, Mahindra, Peach Payments,Joburg Super Kings,FedEx,Betway,SA20}",s1,,SONY,ILCE-7M4,CHENNAI SUPER KINGS,Siddharth K
JSA05118.jpg,https://drive.google.com/file/d/118uOXLiMpYwU4CtkaFZkeA_wsmtdM9dP/view?usp=drivesdk,p8,2025/01/13 17:05,2025/01/13,Evening,1,"Solo,Alone",Close shot,e1,m1,a2,"A cricketer, tattooed and focused, holds a ball near a net during indoor Practice.",Practice jersey,"{Betway, Mahindra, Peach Payments,Joburg Super Kings,FedEx,Betway,SA20}",s1,,SONY,ILCE-7M4,CHENNAI SUPER KINGS,Siddharth K
JSA05112.jpg,https://drive.google.com/file/d/1zWOqQUPIBeNT_IkERPAUjIeyxILerIn4/view?usp=drivesdk,"p25,p8,p23",2025/01/13 17:04,2025/01/13,Evening,3,"Group,together",Wide shot,e1,m1,a11,"Green-jersey players talk during practice; one tosses ball, both focused.",Practice jersey,"{Betway, Mahindra, Peach Payments,Joburg Super Kings,FedEx,Betway,SA20}",s1,,SONY,ILCE-7M4,CHENNAI SUPER KINGS,Siddharth K
JSA05120.jpg,https://drive.google.com/file/d/1v1uYM0PlO8ffDGRT8kTfOTQs5H71YC7l/view?usp=drivesdk,"p17,p6",2025/01/13 17:09,2025/01/13,Evening,2,"Group,together",Close shot,e1,m1,a11,Two green-jersey players talk during practice; one holds glove. Serious discussion.,Practice jersey,"{Betway, Mahindra, Peach Payments,Joburg Super Kings,FedEx,Betway,SA20}",s1,,SONY,ILCE-7M4,CHENNAI SUPER KINGS,Siddharth K
JSA05079.jpg,https://drive.google.com/file/d/1IzNrD-IY5tEIWr-l6QRYiSDlBy3NI0bS/view?usp=drivesdk,p8,2025/01/13 16:48,2025/01/13,Evening,1,"Solo,Alone",Wide shot,e1,m1,a11,"Joburg Super Kings players stand near a chain-link fence, one looking pensive, the other observant. ",Practice jersey,"{Betway, Mahindra, Peach Payments,Joburg Super Kings,FedEx,Betway,SA20}",s1,,SONY,ILCE-7M4,CHENNAI SUPER KINGS,Siddharth K
JSA05098.jpg,https://drive.google.com/file/d/1XG_k096e4DbzS-GFu8WD_ugd3P0qQS5Z/view?usp=drivesdk,p8,2025/01/13 16:56,2025/01/13,Evening,1,"Solo,Alone",Wide shot,e1,m1,a31,"A tattooed cricketer, thoughtfully holds a cricket ball, a pensive expression on his face during indoor practice.",Practice jersey,"{Betway, Mahindra, Peach Payments,Joburg Super Kings,FedEx,Betway,SA20}",s1,,SONY,ILCE-7M4,CHENNAI SUPER KINGS,Siddharth K
