File Name,URL,player_id,DateTimeOriginal,Date,TimeOfDay,NoOfFaces,Focus,Shot Type,event_id,mood_id,action_id,caption,apparel,brands_and_logos,sublocation_id,Location,Make,Model,Copyright,Photographer
JSA00584.jpg,https://drive.google.com/file/d/1e6vpJ6h7Z7bs3qrsPgZaqmgE_fm6I_J8/view?usp=drivesdk,p16,2025/01/08 11:13,2025/01/08,Morning,1,"Solo,Alone",Wide shot,e1,m1,a4,A cricket player in practices his batting stance with great focus..,Practice Jersey,"{Betway, Mahindra, Peach Payments,Joburg Super Kings,FedEx,Betway,SA20}",s1,,SONY,ILCE-7M4,CHENNAI SUPER KINGS,Siddharth K
JSA00575.jpg,https://drive.google.com/file/d/1WZFswmtgpeOtWCIlcEPyqL4Yz6UQ4ryB/view?usp=drivesdk,p27,2025/01/08 11:12,2025/01/08,Morning,1,"Solo,Alone",Wide shot,e1,m1,a4,"A cricketerp ractices Batting, focused intently on the ball.",Practice Jersey,"{Betway, Mahindra, Peach Payments,Joburg Super Kings,FedEx,Betway,SA20}",s1,,SONY,ILCE-7M4,CHENNAI SUPER KINGS,Siddharth K
JSA00565.jpg,https://drive.google.com/file/d/18z5yiTRTPeiM5N9zQsCoEefQV9Vdgl0k/view?usp=drivesdk,p27,2025/01/08 11:11,2025/01/08,Morning,1,"Solo,Alone",Wide shot,e1,m1,a4,"A cricketer stands at the crease, bat in hand, focused and ready for the next ball during a practice session.",Practice Jersey,"{Betway, Mahindra, Peach Payments,Joburg Super Kings,FedEx,Betway,SA20}",s1,,SONY,ILCE-7M4,CHENNAI SUPER KINGS,Siddharth K
JSA00542.jpg,https://drive.google.com/file/d/11q_o0YOavNJQV6ve0gTmrvaRgueG1z4V/view?usp=drivesdk,p1,2025/01/08 11:09,2025/01/08,Morning,1,"Solo,Alone",Wide shot,e1,m1,a4,A cricketer powerfully hits a ball.,Practice Jersey,"{Betway, Mahindra, Peach Payments,Joburg Super Kings,FedEx,Betway,SA20}",s1,,SONY,ILCE-7M4,CHENNAI SUPER KINGS,Siddharth K
JSA00536.jpg,https://drive.google.com/file/d/1l4WAr_8D9QfC5o5NGjj3iAjA3exLnSex/view?usp=drivesdk,p16,2025/01/08 11:08,2025/01/08,Morning,1,"Solo,Alone",Wide shot,e1,m1,a4,A cricket player hits a powerful shot during a practice session.,Practice Jersey,"{Betway, Mahindra, Peach Payments,Joburg Super Kings,FedEx,Betway,SA20}",s1,,SONY,ILCE-7M4,CHENNAI SUPER KINGS,Siddharth K
JSA00528.jpg,https://drive.google.com/file/d/1dFEIVwu3tn4bRLgPMLTi5ywd3aHvaUlA/view?usp=drivesdk,p16,2025/01/08 11:07,2025/01/08,Morning,1,"Solo,Alone",Wide shot,e1,m1,a4,"A cricketer prepares to bat during a practice session, focused intently on the ball.",Practice Jersey,"{Betway, Mahindra, Peach Payments,Joburg Super Kings,FedEx,Betway,SA20}",s1,,SONY,ILCE-7M4,CHENNAI SUPER KINGS,Siddharth K
JSA00517.jpg,https://drive.google.com/file/d/1-oRDemaEEc8pCN8F900f2qFf7Zi5dMQY/view?usp=drivesdk,p27,2025/01/08 11:05,2025/01/08,Morning,1,"Solo,Alone",Close shot,e1,m1,a2,"A cricketer holding his helmet and pads, looks pensive during a Practice session.",Practice Jersey,"{Betway, Mahindra, Peach Payments,Joburg Super Kings,FedEx,Betway,SA20}",s1,,SONY,ILCE-7M4,CHENNAI SUPER KINGS,Siddharth K
JSA00490.jpg,https://drive.google.com/file/d/1iR6mayZZmfREIorOzc6YBm1R7UlIpnQN/view?usp=drivesdk,p27,2025/01/08 11:03,2025/01/08,Morning,1,"Solo,Alone",Wide shot,e1,m1,a4,"A cricketer wearing a helmet, bats defensively during a practice session.",Practice Jersey,"{Betway, Mahindra, Peach Payments,Joburg Super Kings,FedEx,Betway,SA20}",s1,,SONY,ILCE-7M4,CHENNAI SUPER KINGS,Siddharth K
JSA00482.jpg,https://drive.google.com/file/d/1cmdbRsHr_m8nlzoR0oUf98A0sN5bE8uB/view?usp=drivesdk,"p16,p4",2025/01/08 11:03,2025/01/08,Morning,2,"Group,together",Wide shot,e1,m2,a12,Two players in green high-five after practice; yellow pads and helmets stand out on field.,Practice Jersey,"{Betway, Mahindra, Peach Payments,Joburg Super Kings,FedEx,Betway,SA20}",s1,,SONY,ILCE-7M4,CHENNAI SUPER KINGS,Siddharth K
JSA00478.jpg,https://drive.google.com/file/d/1RhHfDuJM5O9Xsa5GQZczbGxqID-sxE1A/view?usp=drivesdk,p4,2025/01/08 11:02,2025/01/08,Morning,1,"Solo,Alone",Wide shot,e1,m1,a5,"A Joburg Super Kings cricketer strolls off the field, bat in hand, after a practice session",Practice Jersey,"{Betway, Mahindra, Peach Payments,Joburg Super Kings,FedEx,Betway,SA20}",s1,,SONY,ILCE-7M4,CHENNAI SUPER KINGS,Siddharth K
JSA00476.jpg,https://drive.google.com/file/d/1iP0cXOBa--cWfKOcCVplsKjNOBJYooj0/view?usp=drivesdk,p4,2025/01/08 11:02,2025/01/08,Morning,1,"Solo,Alone",Wide shot,e1,m1,a4,"A cricket player powerfully hits a ball, with intense focus.",Practice Jersey,"{Betway, Mahindra, Peach Payments,Joburg Super Kings,FedEx,Betway,SA20}",s1,,SONY,ILCE-7M4,CHENNAI SUPER KINGS,Siddharth K
JSA00463.jpg,https://drive.google.com/file/d/1SliFbeo44woexfws7-UIBlv5f01CAU-w/view?usp=drivesdk,p4,2025/01/08 11:02,2025/01/08,Morning,1,"Solo,Alone",Wide shot,e1,m1,a4,A cricketer prepares to strike a ball during a practice session.,Practice Jersey,"{Betway, Mahindra, Peach Payments,Joburg Super Kings,FedEx,Betway,SA20}",s1,,SONY,ILCE-7M4,CHENNAI SUPER KINGS,Siddharth K
JSA00475.jpg,https://drive.google.com/file/d/11WTyEMZPpPguKAKjL-8RxNBm8cnzK7yE/view?usp=drivesdk,p4,2025/01/08 11:02,2025/01/08,Morning,1,"Solo,Alone",Wide shot,e1,m1,a4,A cricketer powerfully drives a ball with focus and determination.,Practice Jersey,"{Betway, Mahindra, Peach Payments,Joburg Super Kings,FedEx,Betway,SA20}",s1,,SONY,ILCE-7M4,CHENNAI SUPER KINGS,Siddharth K
JSA00457.jpg,https://drive.google.com/file/d/1FBZ2_Wd34L5_Jj5Y2_8P3-mfeO1J3ie0/view?usp=drivesdk,p13,2025/01/08 11:01,2025/01/08,Morning,1,"Solo,Alone",Wide shot,e1,m1,a12,Two cricket players converse on the field during a practice session displaying their camaraderie.,Practice Jersey,"{Betway, Mahindra, Peach Payments,Joburg Super Kings,FedEx,Betway,SA20}",s1,,SONY,ILCE-7M4,CHENNAI SUPER KINGS,Siddharth K
JSA02361.jpg,https://drive.google.com/file/d/1VZ8t5QBiw-t7FCkmIpUimKNylPb6O143/view?usp=drivesdk,p10,2025/01/09 13:07,2025/01/09,Afternoon,1,"Solo,Alone",Wide shot,e1,m1,a5,"A JSK player, carrying his helmet and bat, walks across the outfield during practice.",Practice Jersey,"{Betway, Mahindra, Peach Payments,Joburg Super Kings,FedEx,Betway,SA20}",s2,,SONY,ILCE-7M4,CHENNAI SUPER KINGS,Siddharth K
JSA02368.jpg,https://drive.google.com/file/d/18q968Hhco6iuGQJMbTLyZve8FWzJ42U-/view?usp=drivesdk,p8,2025/01/09 13:10,2025/01/09,Afternoon,1,"Solo,Alone",Wide shot,e1,m1,a5,A Joburg Super Kings player walks across the pitch during a practice at a Stadium.,Practice Jersey,"{Betway, Mahindra, Peach Payments,Joburg Super Kings,FedEx,Betway,SA20}",s2,,SONY,ILCE-7M4,CHENNAI SUPER KINGS,Siddharth K
JSA02344.jpg,https://drive.google.com/file/d/1p43AiG1RxnypSxUzAbJNgDyN99N70prL/view?usp=drivesdk,p8,2025/01/09 12:56,2025/01/09,Afternoon,1,"Solo,Alone",Wide shot,e1,m1,a16,"A cricket player in green gazes pensively, mid-stride on a lush green Field.",Practice Jersey,"{Betway, Mahindra, Peach Payments,Joburg Super Kings,FedEx,Betway,SA20}",s3,,SONY,ILCE-7M4,CHENNAI SUPER KINGS,Siddharth K
JSA02353.jpg,https://drive.google.com/file/d/1CVPMJ_jZqvLsxa3GZkrUX0-KVceBUXD1/view?usp=drivesdk,p8,2025/01/09 13:04,2025/01/09,Afternoon,1,"Solo,Alone",Wide shot,e1,m1,a11,Two JSK players in green chat during practice; one holds mitt. Stadium ad behind.,Practice Jersey,"{Betway, Mahindra, Peach Payments,Joburg Super Kings,FedEx,Betway,SA20}",s2,,SONY,ILCE-7M4,CHENNAI SUPER KINGS,Siddharth K
JSA02321.jpg,https://drive.google.com/file/d/1fdRJIcCbfzaqdYlwpozVkjDPjDY5w9G7/view?usp=drivesdk,p10,2025/01/09 12:53,2025/01/09,Afternoon,1,"Solo,Alone",Close shot,e1,m1,a4,"A cricketer powerfully drives a ball during practice, his focused expression evident.",Practice Jersey,"{Betway, Mahindra, Peach Payments,Joburg Super Kings,FedEx,Betway,SA20}",s1,,SONY,ILCE-7M4,CHENNAI SUPER KINGS,Siddharth K
JSA02307.jpg,https://drive.google.com/file/d/1n5gyM6pWqHu-kwmhmOCpIroqgaK5x2Uw/view?usp=drivesdk,p2,2025/01/09 12:51,2025/01/09,Afternoon,1,"Solo,Alone",Wide shot,e1,m1,a4,A cricketer powerfully drives a ball during a net session.,Practice Jersey,"{Betway, Mahindra, Peach Payments,Joburg Super Kings,FedEx,Betway,SA20}",s1,,SONY,ILCE-7M4,CHENNAI SUPER KINGS,Siddharth K
JSA02319.jpg,https://drive.google.com/file/d/1hmTobG_Rw4YS6V2zhDGg2DTMcItIyA4B/view?usp=drivesdk,p10,2025/01/09 12:53,2025/01/09,Afternoon,1,"Solo,Alone",Wide shot,e1,m1,a4,"A cricketer in yellow pads and a green jersey executes a powerful shot during a Practice session, his focused expression evident.  The ball is in mid-air.",Practice Jersey,"{Betway, Mahindra, Peach Payments,Joburg Super Kings,FedEx,Betway,SA20}",s1,,SONY,ILCE-7M4,CHENNAI SUPER KINGS,Siddharth K
JSA02301.jpg,https://drive.google.com/file/d/1r_X0Y4a6bI00EkVpwHylDpRqFgXpNR7I/view?usp=drivesdk,p2,2025/01/09 12:51,2025/01/09,Afternoon,1,"Solo,Alone",Wide shot,e1,m1,a4,"A player powerfully swings his bat during practice, his focused expression evident.",Practice Jersey,"{Betway, Mahindra, Peach Payments,Joburg Super Kings,FedEx,Betway,SA20}",s1,,SONY,ILCE-7M4,CHENNAI SUPER KINGS,Siddharth K
JSA02296.jpg,https://drive.google.com/file/d/1aJp1fxyd_SaHtMbKxbnfpnH_N6l6LO0H/view?usp=drivesdk,p2,2025/01/09 12:51,2025/01/09,Afternoon,1,"Solo,Alone",Wide shot,e1,m1,a4,A cricketer intensely focuses as he prepares to play a shot.,Practice Jersey,"{Betway, Mahindra, Peach Payments,Joburg Super Kings,FedEx,Betway,SA20}",s1,,SONY,ILCE-7M4,CHENNAI SUPER KINGS,Siddharth K
JSA02280.jpg,https://drive.google.com/file/d/1qNavI3gz1fYUKaWNyv8uZvbHhA1Wf1ZD/view?usp=drivesdk,"p12,p13",2025/01/09 12:35,2025/01/09,Afternoon,2,"Group,together",Wide shot,e1,m1,a4,Cricketer hits ball powerfully during net practice.,Practice Jersey,"{Betway, Mahindra, Peach Payments,Joburg Super Kings,FedEx,Betway,SA20}",s1,,SONY,ILCE-7M4,CHENNAI SUPER KINGS,Siddharth K
JSA02279.jpg,https://drive.google.com/file/d/1mndduGxh3zNV8NYfw7OCM9gAUcVL4mS-/view?usp=drivesdk,p22,2025/01/09 12:34,2025/01/09,Afternoon,1,"Solo,Alone",Close shot,e1,m1,a4,A cricket player powerfully drives a ball during practice.,Practice Jersey,"{Betway, Mahindra, Peach Payments,Joburg Super Kings,FedEx,Betway,SA20}",s1,,SONY,ILCE-7M4,CHENNAI SUPER KINGS,Siddharth K
JSA02271.jpg,https://drive.google.com/file/d/1x2f7ANlF6BARvqYyR_gd7UAu28yUrUja/view?usp=drivesdk,"p23,p22",2025/01/09 12:33,2025/01/09,Afternoon,2,"Group,together",Wide shot,e1,m1,a4,"A cricketer in Chennai Super Kings gear Practices his Batting stance, intensely focused on the ball approaching the wicket.",Practice Jersey,"{Betway, Mahindra, Peach Payments,Joburg Super Kings,FedEx,Betway,SA20}",s1,,SONY,ILCE-7M4,CHENNAI SUPER KINGS,Siddharth K
JSA02267.jpg,https://drive.google.com/file/d/1-pkKyJXUhGQ1tx8yavrqivU_dvM8hSIF/view?usp=drivesdk,p22,2025/01/09 12:33,2025/01/09,Afternoon,1,"Solo,Alone",Wide shot,e1,m1,a4,"A cricketer in yellow and green swings his bat during a net session, focused and determined.",Practice Jersey,"{Betway, Mahindra, Peach Payments,Joburg Super Kings,FedEx,Betway,SA20}",s1,,SONY,ILCE-7M4,CHENNAI SUPER KINGS,Siddharth K
JSA02264.jpg,https://drive.google.com/file/d/14AYzO5qTskpO2lQTXWpvFvCTMg1nlvaD/view?usp=drivesdk,"p23,p22",2025/01/09 12:33,2025/01/09,Afternoon,2,"Group,together",Wide shot,e1,m1,a4,"A cricketer in yellow pads and green jersey Practices his Batting stance at the nets, a coach watching from a nearby machine.",Practice Jersey,"{Betway, Mahindra, Peach Payments,Joburg Super Kings,FedEx,Betway,SA20}",s1,,SONY,ILCE-7M4,CHENNAI SUPER KINGS,Siddharth K
JSA02254.jpg,https://drive.google.com/file/d/1bZI5egYXxkGCDBvXFLzMYEYXKFvlfs7X/view?usp=drivesdk,p23,2025/01/09 12:32,2025/01/09,Afternoon,1,"Solo,Alone",Wide shot,e1,m1,a3,"A relaxed cricket coach sits on a yellow roller, surveying the cricket ground.",Practice Jersey,"{Betway, Mahindra, Peach Payments,Joburg Super Kings,FedEx,Betway,SA20}",s2,,SONY,ILCE-7M4,CHENNAI SUPER KINGS,Siddharth K
JSA02252.jpg,https://drive.google.com/file/d/1pW50CqH2BuSw7RsIeMWGEqw4uGOhAgQN/view?usp=drivesdk,p23,2025/01/09 12:32,2025/01/09,Afternoon,1,"Solo,Alone",Wide shot,e1,m1,a7,"A cricket coach sits on a yellow roller, hands behind head, at a Stadium.",Practice Jersey,"{Betway, Mahindra, Peach Payments,Joburg Super Kings,FedEx,Betway,SA20}",s2,,SONY,ILCE-7M4,CHENNAI SUPER KINGS,Siddharth K
JSA02249.jpg,https://drive.google.com/file/d/1X5LvVMTQrSkudT33JAgU07gqLWz2EJHJ/view?usp=drivesdk,"p23,p13",2025/01/09 12:30,2025/01/09,Afternoon,2,"Group,together",Wide shot,e1,m1,a7,"Relaxed cricket coach sits on a small vehicle during a Training session, hands behind his head, smiling.  He's wearing team colors.",Practice Jersey,"{Betway, Mahindra, Peach Payments,Joburg Super Kings,FedEx,Betway,SA20}",s3,,SONY,ILCE-7M4,CHENNAI SUPER KINGS,Siddharth K
JSA02239.jpg,https://drive.google.com/file/d/163PHVXKMW8b7B8ARd_SJKtdNUMa5WZO_/view?usp=drivesdk,p23,2025/01/09 12:29,2025/01/09,Afternoon,1,"Solo,Alone",Wide shot,e1,m1,a7,Cricket coaches relax on a yellow roller during a Training session on a well-maintained grass pitch.,Practice Jersey,"{Betway, Mahindra, Peach Payments,Joburg Super Kings,FedEx,Betway,SA20}",s2,,SONY,ILCE-7M4,CHENNAI SUPER KINGS,Siddharth K
JSA02244.jpg,https://drive.google.com/file/d/1Uqg99Wi9KyR_vzqW58hnI2P4FG4_mi6G/view?usp=drivesdk,p23,2025/01/09 12:29,2025/01/09,Afternoon,1,"Solo,Alone",Wide shot,e1,m1,a7,Cricket coach relaxes on a yellow roller.,Practice Jersey,"{Betway, Mahindra, Peach Payments,Joburg Super Kings,FedEx,Betway,SA20}",s2,,SONY,ILCE-7M4,CHENNAI SUPER KINGS,Siddharth K
JSA02234.jpg,https://drive.google.com/file/d/1D7Ttkm6D0fequFp8lQpaRFoBz_hCU5YF/view?usp=drivesdk,"p8,p23",2025/01/09 11:56,2025/01/09,Morning,2,"Group,together",Wide shot,e1,m1,a11,Cricket players in green jerseys and yellow leg guards chat on the field during a SA20 match Practice session.  One holds a glove.,Practice Jersey,"{Betway, Mahindra, Peach Payments,Joburg Super Kings,FedEx,Betway,SA20}",s2,,SONY,ILCE-7M4,CHENNAI SUPER KINGS,Siddharth K
JSA02238.jpg,https://drive.google.com/file/d/1C7BLdpM_kaoZku6ThQhNmpoMCLxdOSQS/view?usp=drivesdk,p23,2025/01/09 12:28,2025/01/09,Afternoon,1,"Solo,Alone",Wide shot,e1,m1,a3,Cricket coach relaxes on a roller while another assists.,Practice Jersey,"{Betway, Mahindra, Peach Payments,Joburg Super Kings,FedEx,Betway,SA20}",s3,,SONY,ILCE-7M4,CHENNAI SUPER KINGS,Siddharth K
JSA02226.jpg,https://drive.google.com/file/d/1BSOXflMgayfUaBU_vmZGybDEwwP98JpT/view?usp=drivesdk,p19,2025/01/09 11:55,2025/01/09,Morning,1,"Solo,Alone",Wide shot,e1,m1,a1,A cricket bowler delivers a ball during practice while a coach observes intently.,Practice Jersey,"{Betway, Mahindra, Peach Payments,Joburg Super Kings,FedEx,Betway,SA20}",s1,,SONY,ILCE-7M4,CHENNAI SUPER KINGS,Siddharth K
JSA02222.jpg,https://drive.google.com/file/d/1dj8m_6-IGDa5CMS0djwoYc53fd_DkU92/view?usp=drivesdk,"p19,p6",2025/01/09 11:55,2025/01/09,Morning,2,"Group,together",Wide shot,e1,m1,a1,Cricketer runs in to bowl during practice; coach watches. Focus on bowlers determined expression.,Practice Jersey,"{Betway, Mahindra, Peach Payments,Joburg Super Kings,FedEx,Betway,SA20}",s1,,SONY,ILCE-7M4,CHENNAI SUPER KINGS,Siddharth K
JSA02218.jpg,https://drive.google.com/file/d/1CvicXNhnW-NQeR5NdyTqkcuV7ObSYv-T/view?usp=drivesdk,p5,2025/01/09 11:54,2025/01/09,Morning,1,"Solo,Alone",Wide shot,e1,m1,a1,"A cricket bowler, mid-delivery, with a focused expression, bowls towards the wickets during a practice session. ",Practice Jersey,"{Betway, Mahindra, Peach Payments,Joburg Super Kings,FedEx,Betway,SA20}",s2,,SONY,ILCE-7M4,CHENNAI SUPER KINGS,Siddharth K
JSA02203.jpg,https://drive.google.com/file/d/1iieXaG-59lL1jRCoaKxWc9qTjPpBaZTm/view?usp=drivesdk,p10,2025/01/09 11:53,2025/01/09,Morning,1,"Solo,Alone",Wide shot,e1,m1,a1,A cricket bowler delivers a ball during a practice session.,Practice Jersey,"{Betway, Mahindra, Peach Payments,Joburg Super Kings,FedEx,Betway,SA20}",s1,,SONY,ILCE-7M4,CHENNAI SUPER KINGS,Siddharth K
JSA02198.jpg,https://drive.google.com/file/d/18hfM38PiqizG0Fp9hUa_BLE1Q4a6aoND/view?usp=drivesdk,"p6,p10",2025/01/09 11:53,2025/01/09,Morning,2,"Group,together",Wide shot,e1,m1,a1,A cricket bowler delivers a ball during a practice session as the coach watch intently.,Practice Jersey,"{Betway, Mahindra, Peach Payments,Joburg Super Kings,FedEx,Betway,SA20}",s1,,SONY,ILCE-7M4,CHENNAI SUPER KINGS,Siddharth K
JSA02207.jpg,https://drive.google.com/file/d/1LAS1DpBoVyEgBDV91wYvYGUlLQZ1TYRt/view?usp=drivesdk,p2,2025/01/09 11:53,2025/01/09,Morning,1,"Solo,Alone",Wide shot,e1,m1,a1,"A cricketer delivers a ball during a Practice session, with focus while a wicket-keeper and coach observe nearby.",Practice Jersey,"{Betway, Mahindra, Peach Payments,Joburg Super Kings,FedEx,Betway,SA20}",s1,,SONY,ILCE-7M4,CHENNAI SUPER KINGS,Siddharth K
JSA02196.jpg,https://drive.google.com/file/d/12LpNOfHt9aqo8F6qVssCaH6ktMS6n44s/view?usp=drivesdk,p19,2025/01/09 11:52,2025/01/09,Morning,1,"Solo,Alone",Wide shot,e1,m1,a5,A Chennai Super Kings cricketer celebrates a delivery during Practice as teammates watch.,Practice Jersey,"{Betway, Mahindra, Peach Payments,Joburg Super Kings,FedEx,Betway,SA20}",s1,,SONY,ILCE-7M4,CHENNAI SUPER KINGS,Siddharth K
JSA02182.jpg,https://drive.google.com/file/d/1jcf9gTFK1xuessYa4Z2lPGV07EyCjQWl/view?usp=drivesdk,p24,2025/01/09 11:52,2025/01/09,Morning,1,"Solo,Alone",Wide shot,e1,m1,a1,"A cricket bowler in vibrant green delivers a ball during a Practice session, while teammates and a coach observe.",Practice Jersey,"{Betway, Mahindra, Peach Payments,Joburg Super Kings,FedEx,Betway,SA20}",s1,,SONY,ILCE-7M4,CHENNAI SUPER KINGS,Siddharth K
JSA02150.jpg,https://drive.google.com/file/d/1hbvbwufN_ZtgQxJ_eRHoSUIReWuloQKp/view?usp=drivesdk,p7,2025/01/09 11:48,2025/01/09,Morning,1,"Solo,Alone",Wide shot,e1,m1,a2,"Cricket players Practice at the Stadium. One bats, the other celebrates, showcasing their skills and team spirit during a Training session.",Practice Jersey,"{Betway, Mahindra, Peach Payments,Joburg Super Kings,FedEx,Betway,SA20}",s2,,SONY,ILCE-7M4,CHENNAI SUPER KINGS,Siddharth K
JSA02186.jpg,https://drive.google.com/file/d/1gGxavs4a8klXCITLAf6r4gCZY9uwi7HF/view?usp=drivesdk,p24,2025/01/09 11:52,2025/01/09,Morning,1,"Solo,Alone",Wide shot,e1,m1,a1,"A cricket bowler in green delivers the ball during a match, while teammates and a coach observe. The focus is on the bowler's intense action.",Practice Jersey,"{Betway, Mahindra, Peach Payments,Joburg Super Kings,FedEx,Betway,SA20}",s2,,SONY,ILCE-7M4,CHENNAI SUPER KINGS,Siddharth K
JSA02145.jpg,https://drive.google.com/file/d/1C_0X8htL8h0xdrvLMBmI468WRCI6Six4/view?usp=drivesdk,p19,2025/01/09 11:47,2025/01/09,Morning,1,"Solo,Alone",Wide shot,e1,m1,a5,"Smiling Chennai Super Kings player in vibrant green kit during Practice, with a Stadium backdrop.",Practice Jersey,"{Betway, Mahindra, Peach Payments,Joburg Super Kings,FedEx,Betway,SA20}",s1,,SONY,ILCE-7M4,CHENNAI SUPER KINGS,Siddharth K
JSA02135.jpg,https://drive.google.com/file/d/1sozipaybv64X53egqAKyKHskW88MkwQL/view?usp=drivesdk,"p23,p20,p12",2025/01/09 11:46,2025/01/09,Morning,3,"Group,together",Wide shot,e1,m1,a2,Three players in green uniforms on field; one in helmet and pads. Serious expressions.,Practice Jersey,"{Betway, Mahindra, Peach Payments,Joburg Super Kings,FedEx,Betway,SA20}",s3,,SONY,ILCE-7M4,CHENNAI SUPER KINGS,Siddharth K
JSA02133.jpg,https://drive.google.com/file/d/1QyFoKWGneDeJc_7yVJPq59Gn9jkM4BZy/view?usp=drivesdk,"p23,p20,p12",2025/01/09 11:46,2025/01/09,Morning,3,"Group,together",Wide shot,e1,m1,a13,CSK players and coach discuss during field session. Serious and focused.,Practice Jersey,"{Betway, Mahindra, Peach Payments,Joburg Super Kings,FedEx,Betway,SA20}",s3,,SONY,ILCE-7M4,CHENNAI SUPER KINGS,Siddharth K
JSA02111.jpg,https://drive.google.com/file/d/122AWJRDGe5SUhgbEvQbJSv26sFp-XiXV/view?usp=drivesdk,"p8,p2",2025/01/09 11:44,2025/01/09,Morning,2,"Group,together",Wide shot,e1,m1,a13,Two Joburg Super Kings cricketers converse during a practice session at the ground.,Practice Jersey,"{Betway, Mahindra, Peach Payments,Joburg Super Kings,FedEx,Betway,SA20}",s2,,SONY,ILCE-7M4,CHENNAI SUPER KINGS,Siddharth K
JSA02094.jpg,https://drive.google.com/file/d/19f4dGHRMhTV5wt00rFVx2Ik524s7JH0L/view?usp=drivesdk,"p20,p12",2025/01/09 11:42,2025/01/09,Morning,2,"Group,together",Wide shot,e1,m1,a7,"Two players in green jerseys on field; one with pads, one arms crossed.",Practice Jersey,"{Betway, Mahindra, Peach Payments,Joburg Super Kings,FedEx,Betway,SA20}",s3,,SONY,ILCE-7M4,CHENNAI SUPER KINGS,Siddharth K
JSA02087.jpg,https://drive.google.com/file/d/1glOii_zK3G6oyEkpsbgI23PFc6FGebx8/view?usp=drivesdk,"p10,p15",2025/01/09 11:41,2025/01/09,Morning,2,"Group,together",Wide shot,e1,m1,a19,Two coaches in green kits lead training on lush field; one shows fielding drill.,Practice Jersey,"{Betway, Mahindra, Peach Payments,Joburg Super Kings,FedEx,Betway,SA20}",s2,,SONY,ILCE-7M4,CHENNAI SUPER KINGS,Siddharth K
JSA02079.jpg,https://drive.google.com/file/d/1fonPPA98IFWguAZl__wOTi-ragGDWpR5/view?usp=drivesdk,p7,2025/01/09 11:41,2025/01/09,Morning,1,"Solo,Alone",Close shot,e1,m1,a4,"A cricketer in a green jersey powerfully swings his bat during a match, his focused expression evident.  The Stadium's stands blur in the background.",Practice Jersey,"{Betway, Mahindra, Peach Payments,Joburg Super Kings,FedEx,Betway,SA20}",s2,,SONY,ILCE-7M4,CHENNAI SUPER KINGS,Siddharth K
JSA02057.jpg,https://drive.google.com/file/d/1ZUXw9ULNtCNN2clx4oY5-VvDGrUjHU-A/view?usp=drivesdk,p27,2025/01/09 11:38,2025/01/09,Morning,1,"Solo,Alone",Wide shot,e1,m1,a4,A cricket player in a green jersey drives the ball with focus during a stadium match.,Practice Jersey,"{Betway, Mahindra, Peach Payments,Joburg Super Kings,FedEx,Betway,SA20}",s2,,SONY,ILCE-7M4,CHENNAI SUPER KINGS,Siddharth K
JSA02074.jpg,https://drive.google.com/file/d/12wkAb5aO7ycOk4l0nKdMZar7cxqmJvu6/view?usp=drivesdk,"p23,p12,p20",2025/01/09 11:39,2025/01/09,Morning,3,"Group,together",Wide shot,e1,m1,a13,Coach instructs two players during stadium session. Serious focus.,Practice Jersey,"{Betway, Mahindra, Peach Payments,Joburg Super Kings,FedEx,Betway,SA20}",s2,,SONY,ILCE-7M4,CHENNAI SUPER KINGS,Siddharth K
JSA02056.jpg,https://drive.google.com/file/d/1kTL5mFXIKC731iOJEfBEb09rSfVUQ2vs/view?usp=drivesdk,p27,2025/01/09 11:38,2025/01/09,Morning,1,"Solo,Alone",Wide shot,e1,m1,a4,"A cricketer in a green jersey drives the ball powerfully, focused during a stadium match.",Practice Jersey,"{Betway, Mahindra, Peach Payments,Joburg Super Kings,FedEx,Betway,SA20}",s2,,SONY,ILCE-7M4,CHENNAI SUPER KINGS,Siddharth K
JSA02036.jpg,https://drive.google.com/file/d/1rb--B1wGKQ9NpjV6H-mRNQGu94Q-l1-j/view?usp=drivesdk,p7,2025/01/09 11:36,2025/01/09,Morning,1,"Solo,Alone",Wide shot,e1,m1,a4,"A cricket player in vibrant green and yellow uniform powerfully hits a ball during a match, his focused expression evident. The Stadium's blurred background suggests intense action.",Practice Jersey,"{Betway, Mahindra, Peach Payments,Joburg Super Kings,FedEx,Betway,SA20}",s2,,SONY,ILCE-7M4,CHENNAI SUPER KINGS,Siddharth K
JSA02050.jpg,https://drive.google.com/file/d/1AvII0edgViYQeIi620K3fl-T9s634_Vv/view?usp=drivesdk,p7,2025/01/09 11:37,2025/01/09,Morning,1,"Solo,Alone",Wide shot,e1,m1,a4,"A cricketer in a green jersey powerfully drives a ball, his focused expression evident during a match at a Stadium.",Practice Jersey,"{Betway, Mahindra, Peach Payments,Joburg Super Kings,FedEx,Betway,SA20}",s2,,SONY,ILCE-7M4,CHENNAI SUPER KINGS,Siddharth K
JSA02025.jpg,https://drive.google.com/file/d/1BQRLxO3h91krYDRBLBEH9MRpha57KRpp/view?usp=drivesdk,p7,2025/01/09 11:34,2025/01/09,Morning,1,"Solo,Alone",Wide shot,e1,m1,a4,"A cricketer in vibrant green and yellow kit executes a powerful shot, his focused expression reflecting intense concentration during a match.",Practice Jersey,"{Betway, Mahindra, Peach Payments,Joburg Super Kings,FedEx,Betway,SA20}",s2,,SONY,ILCE-7M4,CHENNAI SUPER KINGS,Siddharth K
JSA02013.jpg,https://drive.google.com/file/d/17XeOEkMwLyz7WExEMOwlXl48qSGOmyQg/view?usp=drivesdk,p27,2025/01/09 11:33,2025/01/09,Morning,1,"Solo,Alone",Wide shot,e1,m1,a4,A cricketer in green and yellow helmet gets ready to bat in a stadium Practice; coach watches behind.,Practice Jersey,"{Betway, Mahindra, Peach Payments,Joburg Super Kings,FedEx,Betway,SA20}",s2,,SONY,ILCE-7M4,CHENNAI SUPER KINGS,Siddharth K
JSA02006.jpg,https://drive.google.com/file/d/1NViDMtCO94acY_fILOzTECf454LeUx22/view?usp=drivesdk,p20,2025/01/09 11:30,2025/01/09,Morning,1,"Solo,Alone",Wide shot,e1,m1,a1,"A cricketer in green runs in to bowl during practice, focused and intense.",Practice Jersey,"{Betway, Mahindra, Peach Payments,Joburg Super Kings,FedEx,Betway,SA20}",s2,,SONY,ILCE-7M4,CHENNAI SUPER KINGS,Siddharth K
JSA02004.jpg,https://drive.google.com/file/d/1weiRmNEeSbkiCD6_NOysHMab9zPXgXHC/view?usp=drivesdk,p11,2025/01/09 11:29,2025/01/09,Morning,1,"Solo,Alone",Wide shot,e1,m1,a21,"Cricket player kneels on the pitch, looking away.",Practice Jersey,"{Betway, Mahindra, Peach Payments,Joburg Super Kings,FedEx,Betway,SA20}",s2,,SONY,ILCE-7M4,CHENNAI SUPER KINGS,Siddharth K
JSA01999.jpg,https://drive.google.com/file/d/1pVWeXcUFzG8FNwpGTVEa7xsyR0mm12N2/view?usp=drivesdk,p22,2025/01/09 11:29,2025/01/09,Morning,1,"Solo,Alone",Wide shot,e1,m1,a2,"A Johannesburg Super Kings cricketer adjusts his gloves during Practice, focused on the upcoming SA20 tournament.",Practice Jersey,"{Betway, Mahindra, Peach Payments,Joburg Super Kings,FedEx,Betway,SA20}",s1,,SONY,ILCE-7M4,CHENNAI SUPER KINGS,Siddharth K
JSA01998.jpg,https://drive.google.com/file/d/16o5Qku4ylAhl1KTjCgnQ3MGlH5qVx_JU/view?usp=drivesdk,p11,2025/01/09 11:29,2025/01/09,Morning,1,"Solo,Alone",Wide shot,e1,m1,a5,A cricketer looks skyward at a stadium.,Practice Jersey,"{Betway, Mahindra, Peach Payments,Joburg Super Kings,FedEx,Betway,SA20}",s2,,SONY,ILCE-7M4,CHENNAI SUPER KINGS,Siddharth K
