File Name,URL,player_id,DateTimeOriginal,Date,TimeOfDay,NoOfFaces,Focus,Shot Type,event_id,mood_id,action_id,caption,apparel,brands_and_logos,sublocation_id,Location,Make,Model,Copyright,Photographer
JSB07339.jpg,https://drive.google.com/file/d/1d3LA5Bohr-kjyPMDZbC69BVsRt85d0-E/view?usp=drivesdk,p22,2025/02/04 16:16,2025/02/04,Evening,1,"Solo,Alone",Wide shot,e1,m1,a1,A cricketer in green throws the ball with focused intensity during a practice session,Practice Jersey,"{Betway, Mahindra, Peach Payments,Joburg Super Kings,FedEx,Betway,SA20}",s1,,SONY,ILCE-7M4,CHENNAI SUPER KINGS,Siddharth K
JSB07329.jpg,https://drive.google.com/file/d/15cV55MWk4lfhHs_JyE48mW7mIp0zX3Fp/view?usp=drivesdk,p7,2025/02/04 16:13,2025/02/04,Evening,1,"Solo,Alone",Close shot,e1,m1,a2,"A cricketer behind the net, eyes locked in focus",Practice Jersey,"{Betway, Mahindra, Peach Payments,Joburg Super Kings,FedEx,Betway,SA20}",s1,,SONY,ILCE-7M4,CHENNAI SUPER KINGS,Siddharth K
JSB07335.jpg,https://drive.google.com/file/d/1w-kOipw6cs6F_8pscrzl8gBXUiRUODTr/view?usp=drivesdk,"p23,p25,p6,p13",2025/02/04 16:15,2025/02/04,Evening,4,"Group,together",Wide shot,e1,m1,a3,Coaches sit relaxed on a bench during training,Practice Jersey,"{Betway, Mahindra, Peach Payments,Joburg Super Kings,FedEx,Betway,SA20}",s1,,SONY,ILCE-7M4,CHENNAI SUPER KINGS,Siddharth K
JSB07309.jpg,https://drive.google.com/file/d/1kRy1pBSYYfF0DmEdmLLJpUK9ZdywVdoQ/view?usp=drivesdk,p5,2025/02/04 16:11,2025/02/04,Evening,1,"Solo,Alone",Wide shot,e1,m1,a4,A cricketer plays a defensive shot with intense focus.,Practice Jersey,"{Betway, Mahindra, Peach Payments,Joburg Super Kings,FedEx,Betway,SA20}",s1,,SONY,ILCE-7M4,CHENNAI SUPER KINGS,Siddharth K
JSB07281.jpg,https://drive.google.com/file/d/1ubCTw5sLiRQMrDU7qM_pVeQwz6VrsMNO/view?usp=drivesdk,p5,2025/02/04 16:05,2025/02/04,Evening,1,"Solo,Alone",Close shot,e1,m1,a4,A cricketer focuses intensely as he strikes a shot.,Practice Jersey,"{Betway, Mahindra, Peach Payments,Joburg Super Kings,FedEx,Betway,SA20}",s1,,SONY,ILCE-7M4,CHENNAI SUPER KINGS,Siddharth K
JSB07299.jpg,https://drive.google.com/file/d/1w2dMnX_e6PcLPNIkRv5RktcTM9_iy3v0/view?usp=drivesdk,p7,2025/02/04 16:09,2025/02/04,Evening,1,"Solo,Alone",Wide shot,e1,m1,a4,A cricketer powerfully drives the ball during practice with intense focus.,Practice Jersey,"{Betway, Mahindra, Peach Payments,Joburg Super Kings,FedEx,Betway,SA20}",s1,,SONY,ILCE-7M4,CHENNAI SUPER KINGS,Siddharth K
JSB07289.jpg,https://drive.google.com/file/d/10oaYjBoUWeQ-Fsq-L4hxvRLlFV6MEihO/view?usp=drivesdk,p5,2025/02/04 16:07,2025/02/04,Evening,1,"Solo,Alone",Close shot,e1,m1,a4,A focused cricketer prepares to strike during practice.,Practice Jersey,"{Betway, Mahindra, Peach Payments,Joburg Super Kings,FedEx,Betway,SA20}",s1,,SONY,ILCE-7M4,CHENNAI SUPER KINGS,Siddharth K
JSB07280.jpg,https://drive.google.com/file/d/19LwHJhBotxUA_qWM90JHzUsXIrUqG2vJ/view?usp=drivesdk,p23,2025/02/04 16:04,2025/02/04,Evening,1,"Solo,Alone",Close shot,e1,m1,a3,"A pensive cricket coach sits on the steps, holding a glove.",Practice Jersey,"{Betway, Mahindra, Peach Payments,Joburg Super Kings,FedEx,Betway,SA20}",s9,,SONY,ILCE-7M4,CHENNAI SUPER KINGS,Siddharth K
JSB07275.jpg,https://drive.google.com/file/d/1_Lz423ugp0HMO9eeuwfUlzXbhr-hJglI/view?usp=drivesdk,p23,2025/02/04 16:02,2025/02/04,Evening,1,"Solo,Alone",Wide shot,e1,m1,a5,A cricket coach in green walks purposefully with a glove in hand during practice.,Practice Jersey,"{Betway, Mahindra, Peach Payments,Joburg Super Kings,FedEx,Betway,SA20}",s1,,SONY,ILCE-7M4,CHENNAI SUPER KINGS,Siddharth K
JSB07265.jpg,https://drive.google.com/file/d/1o_lmzpIRCcoLefhfCk0P2UwWms6zIRNT/view?usp=drivesdk,p6,2025/02/04 15:59,2025/02/04,Afternoon,1,"Solo,Alone",Close shot,e1,m1,a6,A coach catches a ball with a focused expression during a stadium practice session.,Practice Jersey,"{Betway, Mahindra, Peach Payments,Joburg Super Kings,FedEx,Betway,SA20}",s2,,SONY,ILCE-7M4,CHENNAI SUPER KINGS,Siddharth K
JSB07273.jpg,https://drive.google.com/file/d/1Dl6A7JqICNft20m11lFo-qxUJqh9x0VA/view?usp=drivesdk,p27,2025/02/04 16:01,2025/02/04,Evening,1,"Solo,Alone",Wide shot,e1,m1,a7,"A cricketer in green stands pensively on the pitch, bat and pads in hand, waiting his turn on the lush field",Practice Jersey,"{Betway, Mahindra, Peach Payments,Joburg Super Kings,FedEx,Betway,SA20}",s3,,SONY,ILCE-7M4,CHENNAI SUPER KINGS,Siddharth K
JSB07243.jpg,https://drive.google.com/file/d/1vu3pDFSZUYrs4Qhzsr2bxIFn9mpNvdC7/view?usp=drivesdk,p26,2025/02/04 15:58,2025/02/04,Afternoon,1,"Solo,Alone",Close shot,e1,m1,a1,A cricket bowler in a green jersey delivers the ball with intense focus during a sunny practice session.,Practice Jersey,"{Betway, Mahindra, Peach Payments,Joburg Super Kings,FedEx,Betway,SA20}",s3,,SONY,ILCE-7M4,CHENNAI SUPER KINGS,Siddharth K
JSB07235.jpg,https://drive.google.com/file/d/1336UHXJK1VZ2kf8POHAlihCFGn1L-bsv/view?usp=drivesdk,p17,2025/02/04 15:56,2025/02/04,Afternoon,1,"Solo,Alone",Wide shot,e1,m1,a1,"A cricket bowler, mid-air, delivers the ball with intense concentration",Practice Jersey,"{Betway, Mahindra, Peach Payments,Joburg Super Kings,FedEx,Betway,SA20}",s3,,SONY,ILCE-7M4,CHENNAI SUPER KINGS,Siddharth K
JSB07201.jpg,https://drive.google.com/file/d/1o9kMaqNsaq8Wt4DtcYA6BUmW895QVo8O/view?usp=drivesdk,p17,2025/02/04 15:54,2025/02/04,Afternoon,1,"Solo,Alone",Wide shot,e1,m1,a1,A cricket bowler in a green jersey delivers the ball during a sunny outdoor practice session,Practice Jersey,"{Betway, Mahindra, Peach Payments,Joburg Super Kings,FedEx,Betway,SA20}",s3,,SONY,ILCE-7M4,CHENNAI SUPER KINGS,Siddharth K
JSB07164.jpg,https://drive.google.com/file/d/1aQLHER1VEFWVC95snoSS46A1ciNAXZVI/view?usp=drivesdk,p26,2025/02/04 15:48,2025/02/04,Afternoon,1,"Solo,Alone",Wide shot,e1,m1,a1,"A cricketer in mid-air, delivering a ball during a Practice session",Practice Jersey,"{Betway, Mahindra, Peach Payments,Joburg Super Kings,FedEx,Betway,SA20}",s1,,SONY,ILCE-7M4,CHENNAI SUPER KINGS,Siddharth K
JSB07178.jpg,https://drive.google.com/file/d/1jAxTyN_adiRVrKQ-dmoHvjk-aPkg9O-S/view?usp=drivesdk,p17,2025/02/04 15:51,2025/02/04,Afternoon,1,"Solo,Alone",Wide shot,e1,m1,a1,A cricket bowler leaps and delivers a ball.,Practice Jersey,"{Betway, Mahindra, Peach Payments,Joburg Super Kings,FedEx,Betway,SA20}",s3,,SONY,ILCE-7M4,CHENNAI SUPER KINGS,Siddharth K
JSB07158.jpg,https://drive.google.com/file/d/13ODVlGapNhxK1PMo0DAwBWsWQ2DGEZFU/view?usp=drivesdk,p26,2025/02/04 15:48,2025/02/04,Afternoon,1,"Solo,Alone",Wide shot,e1,m1,a1,A cricketer in a green bowls with focus.,Practice Jersey,"{Betway, Mahindra, Peach Payments,Joburg Super Kings,FedEx,Betway,SA20}",s2,,SONY,ILCE-7M4,CHENNAI SUPER KINGS,Siddharth K
JSB07127.jpg,https://drive.google.com/file/d/1lw3XrCGO5t_spdqQ804-_Pi2jmFUDm-S/view?usp=drivesdk,p17,2025/02/04 15:46,2025/02/04,Afternoon,1,"Solo,Alone",Close shot,e2,m1,a1,"A young cricketer in green, dives low to field the ball.",Practice Jersey,"{Betway, Mahindra, Peach Payments,Joburg Super Kings,FedEx,Betway,SA20}",s2,,SONY,ILCE-7M4,CHENNAI SUPER KINGS,Siddharth K
JSB07134.jpg,https://drive.google.com/file/d/1mRYECLvYv8okeXmkyaYs6cx2HQ08RChX/view?usp=drivesdk,p26,2025/02/04 15:46,2025/02/04,Afternoon,1,"Solo,Alone",Wide shot,e1,m1,a1,"Cricketer practices bowling during training, his focused expression highlighting his concentration.",Practice Jersey,"{Betway, Mahindra, Peach Payments,Joburg Super Kings,FedEx,Betway,SA20}",s3,,SONY,ILCE-7M4,CHENNAI SUPER KINGS,Siddharth K
JSB07105.jpg,https://drive.google.com/file/d/19MZm38fDaJ9brjGFgSe6nv8YtmePoaw5/view?usp=drivesdk,p17,2025/02/04 15:44,2025/02/04,Afternoon,1,"Solo,Alone",Close shot,e1,m1,a1,"Bowler in green, focused and mid-delivery, prepares to bowl.",Practice Jersey,"{Betway, Mahindra, Peach Payments,Joburg Super Kings,FedEx,Betway,SA20}",s3,,SONY,ILCE-7M4,CHENNAI SUPER KINGS,Siddharth K
JSB07120.jpg,https://drive.google.com/file/d/1rnhn4uq5JWlKagAFV2CXs_jW3NpUOrS3/view?usp=drivesdk,p17,2025/02/04 15:46,2025/02/04,Afternoon,1,"Solo,Alone",Wide shot,e1,m1,a1,"A player runs to bowl during practice, focused and determined",Practice Jersey,"{Betway, Mahindra, Peach Payments,Joburg Super Kings,FedEx,Betway,SA20}",s3,,SONY,ILCE-7M4,CHENNAI SUPER KINGS,Siddharth K
JSB07102.jpg,https://drive.google.com/file/d/1K1mxOL0_F58UrefdzYLoG37ULlHDXNfi/view?usp=drivesdk,p17,2025/02/04 15:44,2025/02/04,Afternoon,1,"Solo,Alone",Wide shot,e1,m1,a1,"A bowler in mid-air, delivers the ball with a focused expression ",Practice Jersey,"{Betway, Mahindra, Peach Payments,Joburg Super Kings,FedEx,Betway,SA20}",s3,,SONY,ILCE-7M4,CHENNAI SUPER KINGS,Siddharth K
JSB07101.jpg,https://drive.google.com/file/d/17ehia0MrDSpGgk0yI2RWtyRhh0L1Kpet/view?usp=drivesdk,p17,2025/02/04 15:44,2025/02/04,Afternoon,1,"Solo,Alone",Wide shot,e1,m1,a1,"A cricket bowler in green leaps, ball in hand looking determined during practice.",Practice Jersey,"{Betway, Mahindra, Peach Payments,Joburg Super Kings,FedEx,Betway,SA20}",s2,,SONY,ILCE-7M4,CHENNAI SUPER KINGS,Siddharth K
JSB07084.jpg,https://drive.google.com/file/d/1ubbH3aFBjbuh3okB7yuxEU8xDLueddhi/view?usp=drivesdk,p26,2025/02/04 15:43,2025/02/04,Afternoon,1,"Solo,Alone",Wide shot,e1,m1,a1,"A bowler, mid-delivery, focuses intently, his expression and pose capturing the session's intensity",Practice Jersey,"{Betway, Mahindra, Peach Payments,Joburg Super Kings,FedEx,Betway,SA20}",s2,,SONY,ILCE-7M4,CHENNAI SUPER KINGS,Siddharth K
JSB07080.jpg,https://drive.google.com/file/d/1X5BFCZjr2hTPIFA6RUW3Vk20RYg-1ZdD/view?usp=drivesdk,p26,2025/02/04 15:43,2025/02/04,Afternoon,1,"Solo,Alone",Wide shot,e1,m1,a1,"A cricket bowler delivers a ball during a Practice session, his focused expression evident.",Practice Jersey,"{Betway, Mahindra, Peach Payments,Joburg Super Kings,FedEx,Betway,SA20}",s1,,SONY,ILCE-7M4,CHENNAI SUPER KINGS,Siddharth K
JSB07079.jpg,https://drive.google.com/file/d/1m_cm4985EMa3QqlHLiXBfCo2MkvhrWMw/view?usp=drivesdk,p26,2025/02/04 15:43,2025/02/04,Afternoon,1,"Solo,Alone",Wide shot,e1,m1,a1,"South African cricketer leaps, delivering a ball during a sunny training session.",Practice Jersey,"{Betway, Mahindra, Peach Payments,Joburg Super Kings,FedEx,Betway,SA20}",s1,,SONY,ILCE-7M4,CHENNAI SUPER KINGS,Siddharth K
JSB07065.jpg,https://drive.google.com/file/d/1fISw9NM_z5pRgoaFCPtxkQb2Nr_NpSVu/view?usp=drivesdk,p17,2025/02/04 15:42,2025/02/04,Afternoon,1,"Solo,Alone",Wide shot,e1,m1,a1,Bowler in green delivers a ball with a focused expression and athletic stance.,Practice Jersey,"{Betway, Mahindra, Peach Payments,Joburg Super Kings,FedEx,Betway,SA20}",s1,,SONY,ILCE-7M4,CHENNAI SUPER KINGS,Siddharth K
JSB07054.jpg,https://drive.google.com/file/d/1KkrmeG_MhyCWqomTsnDJG_uIT5gvUQuJ/view?usp=drivesdk,p23,2025/02/04 15:39,2025/02/04,Afternoon,1,"Solo,Alone",Close shot,e1,m1,a8,"Stephen Fleming, coach of the Johannesburg Super Kings, looks on thoughtfully during practice.",Practice Jersey,"{Betway, Mahindra, Peach Payments,Joburg Super Kings,FedEx,Betway,SA20}",s1,,SONY,ILCE-7M4,CHENNAI SUPER KINGS,Siddharth K
JSB07048.jpg,https://drive.google.com/file/d/1RZDIYQEeA0hu5Ss-p5h3fbfyycxPTrvf/view?usp=drivesdk,p22,2025/02/04 15:38,2025/02/04,Afternoon,1,"Solo,Alone",Wide shot,e1,m1,a4,A cricketer intensely focuses as he executes a powerful shot.,Practice Jersey,"{Betway, Mahindra, Peach Payments,Joburg Super Kings,FedEx,Betway,SA20}",s1,,SONY,ILCE-7M4,CHENNAI SUPER KINGS,Siddharth K
JSB07042.jpg,https://drive.google.com/file/d/1FI9kLIz-J2wyWn1Vv7Gk4ICES7WB52Hf/view?usp=drivesdk,p23,2025/02/04 15:33,2025/02/04,Afternoon,1,"Solo,Alone",Close shot,e1,m1,a1,"A cricket coach practices his throw during training, his focused expression reflecting his dedication",Practice Jersey,"{Betway, Mahindra, Peach Payments,Joburg Super Kings,FedEx,Betway,SA20}",s1,,SONY,ILCE-7M4,CHENNAI SUPER KINGS,Siddharth K
JSB07028.jpg,https://drive.google.com/file/d/1m1A4nVT9W9cpEpRVriEgt_8kyooVW83k/view?usp=drivesdk,p13,2025/02/04 15:31,2025/02/04,Afternoon,1,"Solo,Alone",Wide shot,e1,m1,a2,A cricket coach demonstrates a catching technique to a player during a sunny training session.,Practice Jersey,"{Betway, Mahindra, Peach Payments,Joburg Super Kings,FedEx,Betway,SA20}",s1,,SONY,ILCE-7M4,CHENNAI SUPER KINGS,Siddharth K
JSB07018.jpg,https://drive.google.com/file/d/1UvyPD_t6S7a8U0DaXfG1x47qhqnMToFd/view?usp=drivesdk,p17,2025/02/04 15:25,2025/02/04,Afternoon,1,"Solo,Alone",Wide shot,e1,m1,a5,"Two cricket players stroll across a sunny, grassy field during Practice.",Practice Jersey,"{Betway, Mahindra, Peach Payments,Joburg Super Kings,FedEx,Betway,SA20}",s3,,SONY,ILCE-7M4,CHENNAI SUPER KINGS,Siddharth K
JSB07014.jpg,https://drive.google.com/file/d/1MdLM6W1ys2SQVaOmMWcTvPNS92gCwcG7/view?usp=drivesdk,p8,2025/02/04 15:24,2025/02/04,Afternoon,1,"Solo,Alone",Close shot,e1,m1,a5,"A cricketer walks across the field, holding his gloves, during a practice session. ",Practice Jersey,"{Betway, Mahindra, Peach Payments,Joburg Super Kings,FedEx,Betway,SA20}",s3,,SONY,ILCE-7M4,CHENNAI SUPER KINGS,Siddharth K
JSA01482.jpg,https://drive.google.com/file/d/1gUa8kYc9V2XmNGQ-irlbEZCA7p1k0rrW/view?usp=drivesdk,"p27,p13,p4,p24,p22,p20,p10,p7",2025/01/08 20:41,2025/01/08,Night,8,"Group,together",Wide shot,e4,m2,a8,Players show off new jerseys at Kaizer Chiefs' 55th anniversary event.,Casual attire,none,s4,,SONY,ILCE-7M4,CHENNAI SUPER KINGS,Siddharth K
JSA01472.jpg,https://drive.google.com/file/d/1M4HKOdlZAIx_CK_ha6sz7EC0PDWU1oiB/view?usp=drivesdk,"p13,p27,p4,p24,p10,p22,p20,p7",2025/01/08 20:40,2025/01/08,Night,8,"Group,together",Wide shot,e4,m2,a8,Eight JSK players unveil new jerseys at Kaizer Chiefs partnership event.,Casual attire,none,s4,,SONY,ILCE-7M4,CHENNAI SUPER KINGS,Siddharth K
JSA01459.jpg,https://drive.google.com/file/d/1XA4rQQRnDgQ13C8dYhhI3IF1sg-z_l9Y/view?usp=drivesdk,p24,2025/01/08 20:38,2025/01/08,Night,1,"Solo,Alone",Wide shot,e3,m2,a8,JSK player shows jersey #26 with Kaizer Chiefs official at event.,Casual attire,none,s5,,SONY,ILCE-7M4,CHENNAI SUPER KINGS,Siddharth K
JSA01466.jpg,https://drive.google.com/file/d/1iPFD6XFJ4VunIsvfe8-PJwi6jWkrEEez/view?usp=drivesdk,p27,2025/01/08 20:39,2025/01/08,Night,1,"Solo,Alone",Close shot,e3,m2,a8,JSK player receives jersey from club official at Kaizer Chiefs' 55th anniversary; both smiling.,Casual attire,none,s5,,SONY,ILCE-7M4,CHENNAI SUPER KINGS,Siddharth K
JSA01453.jpg,https://drive.google.com/file/d/1ZssWq-lS3L3QUrXWoWEpltfkHRBsl7yy/view?usp=drivesdk,p7,2025/01/08 20:38,2025/01/08,Night,1,"Solo,Alone",Wide shot,e3,m2,a8,"Kaizer Chiefs marks 55 years with a jersey presentation to a JSK player, celebrated with smiles and handshakes",Casual attire,none,s5,,SONY,ILCE-7M4,CHENNAI SUPER KINGS,Siddharth K
JSA01448.jpg,https://drive.google.com/file/d/1-XAtTZVspRBhdDhn5Q0OU7NW6wjgbs-E/view?usp=drivesdk,p13,2025/01/08 20:38,2025/01/08,Night,1,"Solo,Alone",Wide shot,e3,m2,a8,"Kaizer Chiefs marks 55 years with a jersey presentation to a JSK player, celebrated with warm smiles and handshakes.",Casual attire,none,s5,,SONY,ILCE-7M4,CHENNAI SUPER KINGS,Siddharth K
JSA01440.jpg,https://drive.google.com/file/d/17XoG8ApiYyUfvkuvoqfrIJEnF8GKalDL/view?usp=drivesdk,p10,2025/01/08 20:37,2025/01/08,Night,1,"Solo,Alone",Close shot,e3,m2,a8,"Kaizer Chiefs celebrates 55 years by presenting a jersey to a JSK player, shared with smiles and a handshake.",Casual attire,none,s5,,SONY,ILCE-7M4,CHENNAI SUPER KINGS,Siddharth K
JSA01443.jpg,https://drive.google.com/file/d/1hVxZmseqiVaLN2nf-jlL9mHKhbYU2xVf/view?usp=drivesdk,p20,2025/01/08 20:38,2025/01/08,Night,1,"Solo,Alone",Wide shot,e3,m2,a8,"A JSK player receives a jersey as Kaizer Chiefs marks its 55th anniversary, celebrating the moment with warm smiles.",Casual attire,none,s5,,SONY,ILCE-7M4,CHENNAI SUPER KINGS,Siddharth K
JSA01428.jpg,https://drive.google.com/file/d/1eKEBmXxoFaDdeApnAWmqn2mFhXEA5Q08/view?usp=drivesdk,"p22,p4",2025/01/08 20:26,2025/01/08,Night,2,"Group,together",Wide shot,e3,m2,a8,"Kaizer Chiefs present jersey to JSK player during 55th anniversary, symbolizing friendship.",Practice Jersey,"{Betway, Mahindra, Peach Payments,Joburg Super Kings,FedEx,Betway,SA20}",s5,,SONY,ILCE-7M4,CHENNAI SUPER KINGS,Siddharth K
JSA01368.jpg,https://drive.google.com/file/d/1X2ceY604pXG-JNO68YJTg6TLxTtcgnPr/view?usp=drivesdk,"p4,p20,p27",2025/01/08 19:39,2025/01/08,Night,3,"Group,together",Wide shot,e2,m1,a3,Four players watch a football match with intense concentration.,Practice Jersey,"{Betway, Mahindra, Peach Payments,Joburg Super Kings,FedEx,Betway,SA20}",s2,,SONY,ILCE-7M4,CHENNAI SUPER KINGS,Siddharth K
JSA01364.jpg,https://drive.google.com/file/d/1c7V387BpwOGuCNTnEhkT_iEKphYwjcmM/view?usp=drivesdk,"p24,p22,p4,p13,p20",2025/01/08 19:31,2025/01/08,Night,5,"Group,together",Wide shot,e4,m2,a5,"Players in yellow jerseys walk field with flags, crowd cheering at stadium.",Casual Attire,none,s2,,SONY,ILCE-7M4,CHENNAI SUPER KINGS,Siddharth K
JSA01354.jpg,https://drive.google.com/file/d/1uc7yyuUOmI9MJD9mEQt2sZdXe3xh_Jjw/view?usp=drivesdk,"p22,p10",2025/01/08 19:30,2025/01/08,Night,2,"Group,together",Close shot,e4,m2,a10,"Two players embrace, smiling warmly during a football match.",Casual Attire,none,s2,,SONY,ILCE-7M4,CHENNAI SUPER KINGS,Siddharth K
JSA01351.jpg,https://drive.google.com/file/d/1w1csKr-iHQDsQQ-hTiVQBWiUEw8Lpugs/view?usp=drivesdk,"p22,p24",2025/01/08 19:29,2025/01/08,Night,2,"Group,together",Wide shot,e2,m2,a11,"Smiling players embrace at football match, showing team spirit.",Casual Attire,none,s2,,SONY,ILCE-7M4,CHENNAI SUPER KINGS,Siddharth K
JSA01349.jpg,https://drive.google.com/file/d/1MpeJm-lK2clLhfXAni5l-qeH-d_GpLHQ/view?usp=drivesdk,"p22,p7",2025/01/08 19:29,2025/01/08,Night,2,"Group,together",Close shot,e2,m2,a8,A player smiles amidst a crowd at the stadium.,Casual Attire,none,s2,,SONY,ILCE-7M4,CHENNAI SUPER KINGS,Siddharth K
JSA01346.jpg,https://drive.google.com/file/d/1Hfw48hL6Zr8TpI5ZGShMyZ3so8yJMq80/view?usp=drivesdk,"p20,p4,p13,p24",2025/01/08 19:28,2025/01/08,Night,4,"Group,together",Wide shot,e2,m2,a11,Players talk intensely at the stadium.,Practice Jersey,"{Betway, Mahindra, Peach Payments,Joburg Super Kings,FedEx,Betway,SA20}",s2,,SONY,ILCE-7M4,CHENNAI SUPER KINGS,Siddharth K
JSA01335.jpg,https://drive.google.com/file/d/1YpOXpQ70IotDAWZaEmf9kgYC391ZG-UD/view?usp=drivesdk,p24,2025/01/08 19:25,2025/01/08,Night,1,"Solo,Alone",Close shot,e2,m2,a10,"A jubilant player celebrates a victory, raising both hands in a peace sign at the stadium. ",Casual Attire,none,s2,,SONY,ILCE-7M4,CHENNAI SUPER KINGS,Siddharth K
JSA01318.jpg,https://drive.google.com/file/d/1-a4jFcDTWEfhSPP3VJvVjyacHoNlGiOo/view?usp=drivesdk,"p10,p22",2025/01/08 19:22,2025/01/08,Night,2,"Group,together",Close shot,e2,m2,a12,Smiling players celebrate at a stadium after a game.,Casual Attire,none,s2,,SONY,ILCE-7M4,CHENNAI SUPER KINGS,Siddharth K
JSA01327.jpg,https://drive.google.com/file/d/17pgx1znmpFtj7olQw0_woFhCdK9HxuyD/view?usp=drivesdk,p20,2025/01/08 19:24,2025/01/08,Night,1,"Solo,Alone",Close shot,e2,m1,a11,A man looks thoughtfully off to the side.,Casual Attire,none,s2,,SONY,ILCE-7M4,CHENNAI SUPER KINGS,Siddharth K
JSA01332.jpg,https://drive.google.com/file/d/1_n-Yxu5FW7-9ZmalWvMPUuNEEy1zaOUx/view?usp=drivesdk,p13,2025/01/08 19:25,2025/01/08,Night,1,"Solo,Alone",Close shot,e2,m2,a10,"A jubilant cricket player makes a heart with his hands,smiling broadly.",Casual Attire,none,s2,,SONY,ILCE-7M4,CHENNAI SUPER KINGS,Siddharth K
JSA01312.jpg,https://drive.google.com/file/d/1GAUFICrpYdHxWfuSkSxvuZIoX99ewx0g/view?usp=drivesdk,"p24,p4",2025/01/08 19:22,2025/01/08,Night,2,"Group,together",Close shot,e2,m1,a8,"Two JSK players in yellow jerseys at a stadium, smiling, after a match.",Casual Attire,none,s2,,SONY,ILCE-7M4,CHENNAI SUPER KINGS,Siddharth K
JSA01305.jpg,https://drive.google.com/file/d/19z9_sEqizHAOVQ36VYOU9DKG9zhlprRO/view?usp=drivesdk,p7,2025/01/08 19:21,2025/01/08,Night,1,"Solo,Alone",Close shot,e2,m1,a8,A pensive player observes the match from the stands at a packed stadium.,Casual Attire,none,s2,,SONY,ILCE-7M4,CHENNAI SUPER KINGS,Siddharth K
JSA01302.jpg,https://drive.google.com/file/d/17oVU-OZZgGfZqjOCZYAEyHmPjAzcmCcQ/view?usp=drivesdk,"p27,p24,p10,p22,p4,p13,p20,p7",2025/01/08 19:20,2025/01/08,Night,8,"Group,together",Wide shot,e4,m2,a8,"Smiling Johannesburg Super Kings players flash peace signs at the stadium after a match, celebrating their victory.",Casual Attire,none,s2,,SONY,ILCE-7M4,CHENNAI SUPER KINGS,Siddharth K
JSA01303.jpg,https://drive.google.com/file/d/1s4uVNSaBuAvbiy1mjQODjx1X6njqfPb0/view?usp=drivesdk,"p10,p13",2025/01/08 19:20,2025/01/08,Night,2,"Group,together",Wide shot,e2,m2,a8,Smiling Lions players stand among fans at stadium celebration.,Casual Attire,none,s2,,SONY,ILCE-7M4,CHENNAI SUPER KINGS,Siddharth K
JSA01300.jpg,https://drive.google.com/file/d/1gb71fPeX7ru27H5q_8TYb6xQO1UzfMWh/view?usp=drivesdk,"p13,p27,p4,p22,p24,p10,p7,p20",2025/01/08 19:20,2025/01/08,Night,8,"Group,together",Wide shot,e4,m2,a8,Smiling players flash peace signs at FNB Stadium after win.,Casual Attire,none,s2,,SONY,ILCE-7M4,CHENNAI SUPER KINGS,Siddharth K
JSA01291.jpg,https://drive.google.com/file/d/19xMDvu2LOPSQullwzJAmKpqFaL_z55pc/view?usp=drivesdk,"p4,p24,p20",2025/01/08 19:19,2025/01/08,Night,3,"Group,together",Wide shot,e4,m2,a8,"Three Johannesburg Super Kings cricket players smile for a selfie at the Wanderers Stadium in Johannesburg, South Africa.",Casual Attire,none,s2,,SONY,ILCE-7M4,CHENNAI SUPER KINGS,Siddharth K
JSA01283.jpg,https://drive.google.com/file/d/1tIGQlZlJwn76DJAu-xrtl3ItI5xtDhjW/view?usp=drivesdk,p4,2025/01/08 19:18,2025/01/08,Night,1,"Solo,Alone",Close shot,e2,m2,a8,"A player films a match at Johannesburg's FNB Stadium, his face reflecting excitement as he captures the game's energy.",Casual Attire,none,s2,,SONY,ILCE-7M4,CHENNAI SUPER KINGS,Siddharth K
JSA01279.jpg,https://drive.google.com/file/d/1-Qq7i_uBQv0rlUScXCBofnyMfw_Exp-8/view?usp=drivesdk,p24,2025/01/08 19:18,2025/01/08,Night,1,"Solo,Alone",Close shot,e2,m2,a8,"A man in a yellow polo shirt films a sporting event on his phone, his expression a mix of excitement and focus.",Casual Attire,none,s2,,SONY,ILCE-7M4,CHENNAI SUPER KINGS,Siddharth K
JSA01277.jpg,https://drive.google.com/file/d/1tFPfv91mRn4ADB_LI2pUiSD7H2btjp36/view?usp=drivesdk,"p10,p22,p7,p13",2025/01/08 19:18,2025/01/08,Night,4,"Group,together",Close shot,e2,m2,a10,"JSK players and staff join the celebrations at a Kaizer Chiefs match, soaking in the excitement with fans in the background.",Casual Attire,none,s2,,SONY,ILCE-7M4,CHENNAI SUPER KINGS,Siddharth K
JSA01273.jpg,https://drive.google.com/file/d/1XZJKRyW6-NGn7AAk4QGnJL7uq8CNSDeo/view?usp=drivesdk,"p7,p10",2025/01/08 19:18,2025/01/08,Night,2,"Group,together",Close shot,e2,m2,a8,"Player takes a selfie amidst jubilant fans at FNB Stadium, Johannesburg, South Africa, after a match win.",Casual Attire,none,s2,,SONY,ILCE-7M4,CHENNAI SUPER KINGS,Siddharth K
JSA01265.jpg,https://drive.google.com/file/d/1c8_7aySuqs2CJKUeSJ2AfFzmBYBhT9IZ/view?usp=drivesdk,"p27,p22",2025/01/08 19:18,2025/01/08,Night,2,"Group,together",Close shot,e2,m2,a10,Two men clap enthusiastically at a sporting event in a packed stadium where excitement is palpable.,Casual Attire,none,s2,,SONY,ILCE-7M4,CHENNAI SUPER KINGS,Siddharth K
JSA01233.jpg,https://drive.google.com/file/d/1VYfbClTAkrO55ymBLZBfJ7yrg_oZ84um/view?usp=drivesdk,"p27,p4,p13,p20",2025/01/08 19:16,2025/01/08,Night,4,"Group,together",Wide shot,e2,m1,a5,Johannesburg Super Kings players walk down a tunnel with focused strides.,Casual attire,none,s2,,SONY,ILCE-7M4,CHENNAI SUPER KINGS,Siddharth K
JSA01256.jpg,https://drive.google.com/file/d/1p2wkGQ4o4zB2CNI58Yqixs0IkyLukIlU/view?usp=drivesdk,"p4,p24,p20",2025/01/08 19:17,2025/01/08,Night,3,"Group,together",Wide shot,e4,m1,a8,"Four men in yellow and green team apparel stand on a Stadium field, possibly coaches or players, before or after a match.  One holds a jacket.",Casual Attire,none,s2,,SONY,ILCE-7M4,CHENNAI SUPER KINGS,Siddharth K
JSA01260.jpg,https://drive.google.com/file/d/1OCHdKlh4-V4xB1c3yV_LJtSkKy8GoWHl/view?usp=drivesdk,"p27,p13,p22",2025/01/08 19:18,2025/01/08,Night,4,"Group,together",Close shot,e2,m2,a10,Excited JSK players and fans celebrate goal at FNB Stadium.,Casual Attire,none,s2,,SONY,ILCE-7M4,CHENNAI SUPER KINGS,Siddharth K
JSA01227.jpg,https://drive.google.com/file/d/1ZlMmMdMwcjXKvFXoRVk0UCMO2GH3l2a-/view?usp=drivesdk,"p27,p20,p4,p13,p22",2025/01/08 19:16,2025/01/08,Night,5,"Group,together",Wide shot,e2,m1,a5,"Players in yellow and green walk tunnel, some dejected after match.",Casual attire,none,s2,,SONY,ILCE-7M4,CHENNAI SUPER KINGS,Siddharth K
JSA01212.jpg,https://drive.google.com/file/d/1xJFbIZfVs7KuBvo9OnYOnGoX9d3TLhaN/view?usp=drivesdk,"p27,p24,p20,p7",2025/01/08 19:16,2025/01/08,Night,4,"Group,together",Wide shot,e3,m2,a5,"Players in yellow and green jerseys walk down a corridor, smiles on their faces, heading towards a match.  A bag with the CAF and Puma logos is carried nearby.",Practice Jersey,"{Betway, Mahindra, Peach Payments,Joburg Super Kings,FedEx,Betway,SA20}",s2,,SONY,ILCE-7M4,CHENNAI SUPER KINGS,Siddharth K
JSA01217.jpg,https://drive.google.com/file/d/1f9sQyfTIcq7ohjKmiHt6kDnEEic3qng3/view?usp=drivesdk,"p4,p20,p13",2025/01/08 19:16,2025/01/08,Night,3,"Group,together",Wide shot,e4,m2,a5,Cricket players in yellow-green chat and smile walking tunnel with black balloons.,Casual Attire,none,s2,,SONY,ILCE-7M4,CHENNAI SUPER KINGS,Siddharth K
JSA01202.jpg,https://drive.google.com/file/d/1g13Oyb8_qGmuCTBVzCB06ISlVjS-a_TI/view?usp=drivesdk,"p27,p22,p24,p10,p13,p20,p7",2025/01/08 19:12,2025/01/08,Night,7,"Group,together",Wide shot,e4,m1,a5,"SA cricket players in yellow shirts stroll walkway, smiling after match.",Casual Attire,none,s4,,SONY,ILCE-7M4,CHENNAI SUPER KINGS,Siddharth K
